n13315843,西南航空取消无薪休假 员工未接种疫苗可上班
n13315881,前州参议员解释中共在加州的影响
n13315811,消息：FDA拟批准混合搭配注射疫苗加强剂
n13316529,橙县两党民选官员致信总统 吁调查漏油事件
n13316610,美国华尔街竖立大猩猩铜像 与铜牛相望
n13316826,美青少年驾驶安全周 执法人员吁监护人关注
n13316879,洛城幽灵枪大增4倍 市议会提管制动议
n13316819,经历19次流产 美国妈妈喜诞6.4公斤巨婴
n13317084,捕获率五千万分之一 稀有双色龙虾在美国展出
n13318502,缉毒局本周六全美回收过期处方药
n13318455,拒查顾客疫苗卡 旧金山In-N-Out汉堡店遭关闭
n13318489,美FDA批准莫德纳和强生加强针 可混合使用
n13319099,街头艺人唱美国歌手的招牌歌 不知本尊现身
n13319226,未查顾客疫苗证明被关店 In-N-Out汉堡发声明
n13319295,纽森扩大干旱紧急令 纳入南加州
n13320532,拒打疫苗 新泽西近250名医院员工遭解雇
n13319708,女高管重病陷抑郁 蜂鸟世界重燃其生活希望
n13320566,莫德纳加强剂被批准 6.2万新泽西人已注射
n13320997,罗文大学建世界级恐龙博物馆 计划后年开放
n13321170,物价飞涨 除汽油外还有哪些东西涨价？
n13320935,美CDC：若买了未标注产地的洋葱 立即扔掉
n13321421,今年万圣节 儿童是否想讨糖？
n13321349,美卫生署长：接种疫苗儿童在校仍需戴口罩
n13321891,拍戏时道具枪走火 知名影星鲍德温误杀摄影师
n13322614,CDC推荐COVID-19疫苗加强剂 美国人可混打
n13322032,高中生联合NGO 为患绝症老兵建轮椅坡道
n13323418,CDC主任：加强针推广或改变完全接种的定义
n13323885,正统犹太教地区是打疫苗人数最少地区
n13323902,保护租客 市议会扩大无骚扰计划证书
n13323881,降低地铁噪音 新法要求MTA每年提报告
n13324181,美FDA：辉瑞疫苗对5-11岁儿童似乎有效
n13324683,美国人搬家 最爱往哪些州搬
n13325246,印度制芳香喷雾剂含细菌酿2死 沃尔玛召回
n13323638,抗癌和减缓衰老 五种坚果在美国最畅销
n13326152,佛州重大交通事故 17辆车涉事 26人伤
n13326753,“你就像天使”女呼吸治疗师抵御病毒有奇招
n13326962,Sigma Nu之家丑闻后 南加大禁所有兄弟会活动
n13327253,睽违两年半神韵将临 粉丝期盼
n13327240,美国西岸遭遇强风暴袭击 数十万用户断电
n13327749,汽车的颜色如何影响转售的价格？
n13327896,持枪男子抢商店 被前美军陆战队员秒收拾
n13327853,美国热心路人主动停车 合力阻止一妇女跳桥
n13328332,美国人退休后想去哪儿 2021-2022年排名出炉
n13329167,佛州积极招募外州警察 给五千美元安家费
n13329623,疫情下台湾电影洛城展“翩翩人生”
n13329778,科学家：疫苗加强针或使年轻人患心肌炎
n13329809,领导反职场性骚扰运动 苹果员工称被解雇
n13329820,波音员工西雅图抗议强制接种COVID-19疫苗
n13329824,700磅卧床男8个月减肥260磅 单膝跪地求婚成功
n13329834,三名美国士兵被谋杀 前塔利班成员否认指控
n13329870,美国度假预定激增 航空公司蜂拥而至
n13329742,加州三女子涉盗游民援助金 被控56项重罪
n13330043,橙县举办工作与劳动力发展博览会
n13330454,你见过美国警察“遛鳄鱼”吗？
n13331153,加州“炸弹气旋”东移 纽约新州宣布紧急状态
n13331491,徐延军携200张私人照 胁迫美工程师当间谍
n13331727,NBA球星抨击耐克对中共恶行保持“沉默”
n13331852,好莱坞名导夺命片场 专家忠告拥枪须自重
n13331828,美日用品公司：卫生纸、纸巾、纸尿布将涨价
n13331871,加州港口集装箱弃社区 警方开400逾张罚单
n13332010,数千户拉古纳滩居民上周末两度断电
n13332061,洛县使用中国制COVID试剂供民众免费检测
n13331894,美国医护为何宁可丢工作也不接种疫苗
n13332479,美议员忧社交平台伤害儿童 促公开内部研究
n13332726,雷神公司CEO：疫苗令将使公司损失数千人
n13330174,嚼冰块会伤害牙齿吗？ 美国牙医这么说
n13332786,鲨鱼在潜水员附近徘徊 海豚展开“保护”行动
n13333073,组图：废金属打造的大型动物雕塑 独特逼真
n13333984,美零售巨头下架中国监控产品 指其迫害人权
n13334312,德州通过法案：学生运动员需按出生性别参赛
n13334626,藉投资移民项目诈2280万美元 加州华女认罪
n13334660,美国罗格斯大学强制员工打疫苗 违者或遭解雇
n13334684,韩裔高中生摘得2022年玫瑰后冠
n13334680,全美最幸福州排名 新泽西位列第三
n13334821,洛市将给3200贫户发生活费 月付1000美元
n13334429,美零售商会料今年假日季销售额将创新高
n13334864,亚裔人士质疑洛县反亚裔仇恨犯罪上升的报告
n13334714,消息：白宫将推气候新规 无论国会是否支持
n13334908,送外卖挣零花 不单局限餐饮业
n13334971,加强居民联系 核桃市办第二届“家庭博览会”
n13334488,纽约消防员工会：疫苗令或致3成消防站关闭
n13337136,前纽约州长库默被控“性犯罪”
n13337279,好社区建平价房 洛市议会批准优先考虑
n13337219,民调：37%未接种美国员工会因疫苗令而辞职
n13337234,【横河观点】《科学》刊登MERS实验的争议
n13337402,11月起 南加爱迪生将更改230万用户收费标准
n13337775,尔湾成为第44市 支持橙县退伍军人墓地新址
n13338183,南达科他州签署命令 放宽疫苗豁免规定
n13338084,美国最老垒球队全是奶奶级球员 最老逾90岁
n13335926,组图：帝国大厦登高赛 马来西亚选手夺冠
n13338913,疫情下 中国网红为啥往上海Costco跑
n13339499,抵制疫苗令之际 佛州疫情数字达全美最低
n13339706,LAX枪手虚惊 300人被疏散到停机坪
n13339629,美国会议员：无须强制儿童接种COVID-19疫苗
n13339901,蒙面男亚市银行抢钱在逃 FBI 介入调查
n13340026,加州高密度新住房政策是否凌驾HOA？
n13340144,加州比格犬自由项目回应NIAID幼犬测试
n13339963,未报告除湿机缺陷 中国公司被罚9100万美元
n13340166,居民担忧玛丽安德尔湾成游民安置点
n13340067,美FDA批准为5至11岁儿童接种辉瑞疫苗
n13340893,巨大太阳耀斑引发天空奇观 欧美可见北极光
n13340766,美国动物园迎来白色小袋鼠宝宝 超罕见
n13341140,拜登政府推疫苗强制令 19个州起诉
n13341428,【快讯】美铁列车在南卡撞汽车 酿三死一伤
n13341563,全美鲜花短缺？花农：有花没人采摘运输
n13341643,美最高院拒绝审理缅因州疫苗接种紧急上诉案
n13341768,CDC：已接种疫苗者的感染及死亡人数上升
n13341907,FDA专家批准儿童接种疫苗 议员提出质疑
n13342438,司机受困洪流遇险 美海军陆战队员推车营救
n13343286,因天气及人员短缺 美航空取消1400周末航班
n13344020,美国航空万圣节周末取消1500个航班
n13344637,咖啡店老板自建硫磺岛升旗雕像 向美军致敬
n13344987,数千蝠鲼以完美阵式惊现加州 潜水员与其共泳
n13345661,FDA调查莫德纳疫苗副作用 评估青少年是否适用
n13345853,阿拉斯加两天降雪达12英尺 创纪录
n13346108,被中共间谍黏上 美华裔工程师沦为司机
n13346239,撞伤6人后逃逸 长滩警方正追寻肇事者
n13346539,人行道上撞伤6人逃逸 长滩肇事者落网
n13346667,科技中心演练救火 消防隐患警钟常鸣
n13346290,《沉默呼声》获奥斯汀影展“观众选择奖”
n13346583,毒贩用奴工在俄勒冈大规模非法种植大麻
n13347260,工会：针对美国警察的伏击比去年增139%
n13347308,赛马遭弃沙漠瘦骨嶙峋 幸遇救援队奇迹康复
n13347259,事故现场 美消防员给女童读故事书 照片热传
n13348323,特斯拉在美召回1.2万汽车 软件问题存安全隐患
n13348852,流产率或被大幅低估 专家吁孕妇停止接种疫苗
n13348992,攻击空姐的尔湾华裔男一万交保 15日再审
n13349084,19岁河滨男残害小狗 被判入狱2年
n13349164,两医疗机构员工联手抗议人手不足及安全隐患
n13348784,《归途》再获奖 主创团队出席多伦多颁奖典礼
n13349480,美国女子因车祸昏迷 醒来后竟有多国口音
n13350110,小白球被鳄鱼咬走 挥杆的美国男子笑歪了
n13350008,新生儿没有婴儿床 美消防队马上送一新床
n13350379,惊人巧合 美国一家庭祖孙三代同一天生日
n13351776,加州开始为5-11岁儿童打疫苗
n13351931,加州全保正式开放申请 1月31日截止
n13352346,疾病无情人有情 费城社区齐助患癌亚裔夫妇
n13353022,美海军退役后抑郁染毒 服务犬助其重回正轨
n13352726,父母中毒气 9岁童解锁父亲iPhone救全家
n13352093,五大原因 导致美航空旅行变得不稳定
n13353492,拜登政府宣布企业疫苗令于1月4日生效
n13354125,儿童抵税预付款 低收入家庭如何申请？
n13354093,大拖车被盗后 警方彻夜缓慢追捕
n13353966,夏令时即将结束 美19州欲全年实行夏令时
n13354186,2022年平价医保注册开启 九成人将获援助
n13354262,辉瑞疫苗研发涉违规？吹哨人的指控在调查中
n13354434,BB枪手虚惊 圣马利诺市两校一度被关
n13354190,联合国气候与会中 洛市长COVID检测呈阳性
n13354496,共赛激情耐力 洛杉矶与纽约马拉松同天开跑
n13354289,反对强制打疫苗 美国各地民众罢工抗议
n13354535,拜登政府就选举改革法起诉德州
n13355398,英媒：美国CIA使用灵媒的超能力执行任务
n13356527,无证移民可领疫情救济金 新泽西开放“被排除工人基金”申请
n13356587,维德孟华中文学校参加2022年抗乳癌健行
n13356786,盖茨警告：做病菌演习 以应对生化恐袭
n13357088,辉瑞董事：美国疫情可能在明年1月结束
n13357185,纽约市住宅租金回温至疫情前
n13357174,29岁华女惨死 嫌犯被加控仇恨犯罪
n13357210,八大道废弃加油站上盖游民所 需先治污染
n13357164,纽约市马拉松 交通须知
n13357285,美二战老兵百岁生辰 忆“诺曼第战役”
n13357148,周经皓接任国际狮子会法拉盛分会会长
n13357204,美国男子被妻子逼买乐透 结果中240万美元
n13357973,休斯顿音乐节酿悲剧 至少8人死多人伤
n13356446,美加冬令时周日开始 你需要注意哪些事
n13356391,今冬去哪儿度假？美最佳冬季度假胜地出炉
n13358302,不要尝试 七种用火用电方式易酿火灾
n13358359,美联邦上诉庭暂停拜登的企业疫苗强制令
n13358868,美国气象主播用这招 看起来像飘在云朵上
n13358919,报导尼日利亚宗教迫害 大纪元时报记者被捕
n13359236,只带500美元到美国追梦 他从睡公园变富翁
n13359695,是否卖10%特斯拉股 马斯克要网友投票决定
n13360359,美多所大学遭炸弹威胁 警方未发现可疑爆炸物
n13361088,美国喜剧作家与女儿的对话 令人喷饭（上）
n13360834,一名加州男子因涉嫌杀妻被捕
n13361451,故意利用空气注射脑干 德州男护承认谋杀四人
n13361866,美解除入境禁令 机场和美墨加边境排长龙
n13361321,幼童溺水命悬一线 德州妇女快速反应救回命
n13363310,隐匿中国豪赌客 洛县赌场付50万美元认罪
n13363459,加州白冷杉“糖熊”被国会山选为节日树
n13363311,研究：美国2种疫苗效力6个月后低于50%
n13363789,台裔小提琴家表演时断弦 你猜他如何处理？
n13364030,义工们在洛市清理垃圾 并为游民提供帮助
n13364136,美国喜剧作家与女儿的对话 令人喷饭（中）
n13364339,越战老兵紫心勋章遭窃 数十年后奇迹复得
n13365923,大陪审团调查鲍德温公园市大麻许可问题
n13365986,美百岁二战老兵长寿秘诀：信神和珍惜家庭
n13366232,加州选区重划 第一版地图将公布
n13366659,美国喜剧作家与女儿的对话 令人喷饭（下）
n13367566,美国公民入籍人数创十多年来最高
n13367606,费城七千人老兵节游行向退伍军人致敬
n13367965,亿分之一捕获率 超稀有彩虹色龙虾现身缅因州
n13368070,可用手机出示证件 新泽西州长签署几十项新法
n13368124,“跟随到家”偷窃猖獗 洛县警局发警报
n13368350,南加进入干旱紧急状态 供水商吁节水
n13368389,洛市议会提案拟阻科技公司购平价房
n13368766,个人电脑始祖 “苹果一号”以40万美元拍出
n13368332,海豚引路 船长救回被困海上漂流12小时女子
n13369058,组图：精湛技艺 用嘴吹出的玻璃艺术品
n13370229,预告：新世纪影视新片《寻狗》11月12日上映
n13370455,感恩节前神韵莅临新泽西 州长发信祝贺
n13370683,纽约恢复老兵节游行 感谢保卫自由的人
n13370832,组图：纽约老兵节大游行曼哈顿隆重登场
n13371099,学校口罩令是否取消 新泽西州长称或分阶段放宽
n13371136,经济复苏 新泽西捷运将增加列车车次
n13371072,白宫推进疫苗令 新泽西州140万工人受影响
n13371138,美89岁老翁获物理学博士学位 一圆毕生梦想
n13371598,美国教堂出现持枪男子闹场 被英勇牧师制伏
n13372577,美动物园再现新冠病例 圣路易斯8狮虎豹染疫
n13371770,组图：不满防疫措施 旧金山民众聚集抗议
n13372792,家用测试盒现假阳性结果 美FDA召回200万个
n13373204,向国会议员发出死亡威胁 长岛男子被捕
n13373206,警方公布中央公园性侵嫌犯照片
n13373174,美多所名校收到炸弹威胁 纽约大学、麻省理工、南加大也发生
n13373168,新州收购废弃铁路 打造另一座高线公园
n13373188,民调：近七成市民对警察持积极态度
n13373097,橙县老兵节 为牺牲英雄献上一朵红玫瑰
n13373171,医护宗教豁免疫苗案 上诉至最高法院
n13373682,蓝色起源宇航员空难丧生 上月曾成功进入太空
n13373947,美议员：弗州选举结果体现美国父母的选择
n13373009,老人落水险溺亡 爱犬跳入水中成功引救援
n13372978,女友病重昏迷一个月 醒来后 男友病床边求婚
n13374279,美国政府宣布大幅提高红蓝卡保费
n13373738,救生员相助 95岁老人达成亲近沙滩的愿望
n13374393,2021年黑色星期五 如何找最优惠折扣？
n13374378,骇客冒充FBI寄假电邮给数千个组织 警告网攻
n13375864,感恩节旅行预计爆量 美铁吁预约行程
n13376117,五人涉公园吸芬太尼中毒 送医急救
n13375583,CDC：没有自然免疫者传播COVID-19的记录
n13376311,拍到扫帚飘浮空中 美国男子求解
n13376725,杭廷顿海滩码头艺术品集市 接到关闭通知
n13376650,医护帮了愿 97岁老人首穿婚纱庆结婚纪念日
n13377711,宾州Marcus Hook老兵节游行 向退伍军人致敬
n13377504,民调：美逾半数家长不放心儿童接种新冠疫苗
n13378185,110起尾随回家抢劫案 洛杉矶警局：涉6团伙
n13378736,跳蚤市场生财有道 重开体验淘货快乐
n13378817,“圣诞老人行动”征回信义工 帮孩子圆梦
n13378689,婚礼现场 生父突然将继父拉上台一起送女儿
n13379922,马斯克再次抛售股票 专家：税收非唯一原因
n13380254,新规生效 洛市餐馆不再主动提供免费塑料餐具
n13380486,Costco召回Kool-Aid冲泡饮料 或含碎金属玻璃
n13380370,研究：布口罩几乎无法阻止COVID病毒传播
n13380557,违反加州疫情通报法被控 亚马逊达“首例”和解
n13380644,洛杉矶国际车展回归 众多新车首次全球亮相
n13380808,货车被火车撞成两半 司机生日当天奇迹存活
n13380706,大风暴或袭美国东海岸 将影响感恩节出行
n13380690,农民意外离世 社区上百民众自发帮忙收割庄稼
n13380725,组图：美八旬老妇拍卖一辆原装福特古董车
n13381788,600年来最长月偏食本周登场 全美可见
n13382570,美劳工部暂停实施拜登的私企疫苗强制令
n13382827,北美年度车决赛名单揭晓 新车亮相洛杉矶车展
n13383018,受伤小鹿走进医院 还自己搭电扶梯上二楼
n13383517,汽车遭18轮大卡车辗压 美国女车主奇迹生还
n13382709,11岁女儿遇难 父亲基于信仰原谅酒驾嫌犯
n13384330,疫情重创旅游业 新泽西州立法助行业振兴
n13384359,新泽西州开放申请种植加工大麻 部分居民担忧
n13384272,新泽西华尔镇高中橄榄球员涉校园欺凌 县检察官介入调查
n13384367,勿急！真实身份证期限延至2023年5月
n13384617,新泽西迪格兰游乐场宣布 明年建成新景点
n13384907,被骗59万美元 南加爱迪生吁民慎防诈骗电话
n13385102,组图：2021洛杉矶国际车展 多款新车抢先看
n13385329,加大尔湾分校13亿美元新医院破土动工
n13385394,吸毒过量年致死十万 “悲惨里程碑”谁之过
n13385408,饥饿的熊闯入加州7-11找食物 店员尖叫
n13385077,拜登政府与辉瑞达协议 预购千万疗程口服药
n13385796,小婴儿在餐厅噎到 陌生男子急取一物救他
n13385072,目睹窃贼入室作案 两少年用自行车成功拦截
n13386471,COVID-19起源 新研究挑战世卫报告说法
n13386905,美陪审团：少年击毙抗议者属自卫 谋杀罪不成立
n13385757,巡逻警冒雨执勤 10岁男孩主动为她撑伞
n13387185,美批准成年人使用辉瑞与莫德纳疫苗加强剂
n13387151,彭帅失踪 联合国吁调查 白宫表关切
n13387311,今年感恩节恐没火鸡？美国肉类和馅饼或缺货
n13387549,布碌崙劫匪抢钱伤人 警方征询破案线索
n13387471,纽约一油漆工跌落曼哈顿桥 当场身亡
n13387578,国宝银行为医疗与艺术等NPO 申请九万元联邦补助
n13387576,纽约年满18岁成人 完全疫苗接种率达80%
n13387568,“孕产期心灵之旅”讲座：应对产后抑郁及情绪问题
n13387713,火鸡价涨24% 美国今年感恩节大餐将是最贵
n13388132,旧金山一家LV专卖店被洗劫一空 6人被捕
n13387630,退伍军人身心异常流落街头 好心人帮其找到家人
n13388393,美国2021年疫情死亡人数超过2020年 
n13388441,2021全美房价最贵的10个邮编地区是哪些
n13388603,美国加州公路上满地都是钞票 民众停车疯抢
n13389569,美感恩节假日周 风暴来袭 气温波动如过山车
n13389990,圣谷首个游民过渡安置“希望”小区落成
n13390222,感恩节假期 预计200万人抵洛杉矶国际机场
n13390225,美威州一汽车冲入圣诞游行人群 致1死20伤
n13389876,美交通部长：疫苗令不会影响感恩节出行
n13390830,分析：里滕豪斯案的错误信息为何被广传
n13391825,帕萨迪纳男孩在卧室被流弹击中身亡
n13392109,感恩节购物 美国哪些商店开门哪些关闭
n13391956,驾车冲撞威州圣诞游行人群 嫌疑人身份确认
n13391903,疫情未消节日至 出行高峰注意啥
n13392519,加州80蒙面劫匪快闪洗劫商场 分25辆车逃逸
n13393404,越野跑选手多次摔倒 对手拽起他一起奔向终点
n13394083,费城社区感恩节游行感恩神的恩赐
n13393941,黑色星期五去哪里购物 五家商店折扣最好
n13394195,美国航班延误最严重的八个机场
n13394443,劫匪袭击加州时尚零售店 引发愤怒
n13394570,缴房产税截止日将近 有人为何收到额外账单？
n13394633,洛城警方逮捕Grove商场劫案3贼 约20人在逃
n13394347,数十抢匪连续三天集体洗劫加州湾区商店
n13394503,摩根大通CEO：相信我们比共产党活得更长
n13394752,美国男子钓到鲨鱼 被白头鹰抢走
n13395038,感恩节易酿厨房火灾事故 烹饪安全须知
n13395285,美国离奇车祸 SUV把SUV撞飞到SUV上
n13396133,新泽西教师工会对里滕豪斯无罪发“沮丧”声明  在社交媒体遭抨击
n13396199,美感恩节搭机或自驾出游 需要了解的几件事
n13396373,拜登基础设施法案隐含补贴 红灯摄像头会再回来吗？
n13396392,无证建筑工人遭致命事故后 缺乏保护措施
n13395052,美国艺术家绘制颂扬爱国主题的巨幅壁画
n13396539,乔治亚非裔阿伯里枪杀案 三名嫌犯谋杀罪成
n13396652,疫情后感恩节 人们感恩神庇佑 阖家团聚
n13396878,感恩节后迎黑五 各大商家营业时间攻略
n13396922,乘坐飞机不守规 八名乘客遭重罚
n13396973,假日购物季加州抢劫案频发 警方出击制止
n13396996,保障感恩节出行 加州公路巡警局加强执法
n13397100,与市府达成和解协议 DoorDash赔偿532万元
n13396674,白宫：92%联邦雇员在截止期前接种了疫苗
n13397569,美国男子建1米宽迷你教堂 或打破世界纪录
n13397340,祖父母寄送创意礼物 隔空与孙辈共度感恩节
n13398238,吃了感恩节火鸡后打盹？专家释因
n13398612,感恩节后迎黑五 Costco及各商家营业时间一览
n13398798,组图：纽约举行第95届梅西感恩节大游行
n13399019,盗窃车辆催换器 洛杉矶三少年被拘留
n13399135,庆感恩节 橙县举办“火鸡小跑”比赛
n13399213,抗通膨？主流媒体提倡感恩节改吃豆腐火鸡
n13398997,美国九零后高材生对李洪志大师的感恩
n13399060,调查：不打算买节日礼物的美国人今年最多
n13401053,两起比弗利山庄抢劫案中五人被捕
n13401291,快讯：北卡购物中心感恩节发生枪击 三人伤
n13401220,关于黑色星期五 鲜为人知的几个事实
n13401267,爱迪生公司防风断电 三万多用户受影响
n13401190,新数据显示：默克COVID-19口服药疗效较低
n13401377,加州苹果店遭洗劫 四劫匪当众抢2万美元商品
n13401576,组图：纽约米德敦市圣诞游行 法轮功受邀参加
n13401606,黑五Costco肉类大减价 打折猪肉受华人欢迎
n13401838,25年假冒律师行骗得手 专家支招防骗
n13401600,宝洁18种止汗剂含致癌物质 宣布召回
n13401863,值勤中接触芬太尼 两起事件中4人送医
n13401752,亲属移民找错副担保人 案子被拖数年
n13401935,美国21周大早产儿奇迹存活 刷新世界纪录
n13402112,阿拉斯加最大金块拟高价拍卖 重达9公斤
n13402847,今年美国黑五期间 汽车折扣和往年大不同
n13403092,福西：若Omicron已现身美国 不会感到惊讶
n13403169,备战Omicron变体 纽约州宣布将进入紧急状态
n13403385,黑色星期五 洛杉矶发生至少6起快闪窃案
n13403458,美国男子冤狱43年终获释 捐款助他成富翁
n13399459,美国下雪最多的七个城市 纽约州占三个
n13403254,黑五购物 美实体店销售额比疫情前下降28%
n13404408,美国费城感恩节大游行 传统佳节话感恩
n13404456,藏身飞机轮舱偷渡 26岁男迈阿密机场被捕
n13404497,时尚设计师阿布洛因癌症去世 年仅41岁
n13404277,福西：美应准备好对抗Omicron 但封锁尚早
n13404500,百万曾领加州失业金者 或必须提交工作证明
n13405178,被困深山48小时 瑜伽教练靠冥想战胜严寒
n13405387,棒球迷无力带女儿看大赛 对手球迷赠门票
n13406233,【直播】拜登就Omicron最新情况发表讲话
n13406318,Omicron全球蔓延 拜登讲话聚焦六大主题
n13406173,推特首席执行官辞职 首席技术官接任
n13406424,美商务部长吁众院立即通过《芯片法案》
n13406544,美最新疫情一览 最重与最轻的五个州是哪些
n13406557,美法官暂停针对十州医护人员的疫苗强制令
n13406838,好莱坞圣诞大游行疫情后回归 为孩子募玩具
n13406933,如何给圣诞老人写信
n13407175,国会议员朴银珠谈解决供应链混乱
n13407434,美CDC：所有成年人都应接种疫苗加强剂
n13407053,美流浪汉街头弹钢琴一夜成名 将上映传记片
n13407367,美国湖底出土一艘1200年历史的独木舟
n13408658,【快讯】密歇根高中枪击案3死6伤 嫌犯被捕
n13408729,“暖秋”气温笼罩美国中部地区
n13408743,盗贼突袭南加联合太平洋火车集装箱
n13408860,洛杉矶两港第四次延收集装箱滞留费
n13408869,FDA专家组投票 支持默克药厂抗疫口服药
n13408741,法官叫停拜登对联邦承包商疫苗强制令
n13409012,美国邮局发行第三枚虎年邮票
n13409259,女子停机坪上“打旗语”遭LAX拘留
n13409049,主播克里斯·库莫涉兄长丑闻 遭CNN无限期停职
n13409080,罗马尼亚移民警告美国人：吸取共产国家教训
n13409539,洛县重新划选区 集中在两草案修改
n13409420,中共监视美国校园 利用线人压制异议（1）
n13409920,因祸得福？ 美国男子因开刀中百万美元乐透
n13410932,新变种Omicron传染性强 新泽西重启旅行禁令
n13410894,“黑人音乐教父”之妻在家中死于枪杀
n13411272,调查：美1.22亿人将在圣诞节假期出行
n13411541,防范“快闪”抢劫 洛县警署主动出击巡逻
n13411567,漏油事件后 南加州捕鱼活动重开
n13411882,旱情持续 加州水务局发布禁止浪费水草案
n13411867,模特目睹惊险车祸 果断抢救停止呼吸的婴儿
n13411144,密西根高中枪击案 高二生被控谋杀和恐怖主义
n13412237,美国家庭清理出一枚炮弹 里面竟装满财宝
n13413218,拜登延长飞机上口罩令 加强Omicron测试
n13413370,全美前十名最致命公路 两条穿过新泽西
n13413286,南非医学协会主席：Omicron症状很轻微
n13413467,疫情重击加政策限制 28%新泽西企业准备关门
n13413586,科罗拉多州发现全美第三例Omicron感染病例
n13413817,纽约州发现五人感染Omicron变种病毒
n13413505,音乐名人妻子家中遭枪杀 加州警方逮捕嫌犯
n13413858,顺手牵羊偷商品超30万美元 妇人被捕
n13413927,假释犯偷价值20万军用悍马车 获判近三年监禁
n13414049,国会大厦被捕者家属求助
