n13506032,为100元枪杀19岁收银员 凶嫌被控谋杀罪
n13505982,医疗物资供应紧张 美国医院斥资自己生产口罩
n13505932,5G网络或影响飞机着陆 美航空局制定规则
n13506330,洛杉矶盗贼转战货运列车 铁路盗窃案增160%
n13506913,冬季风暴袭美25州 周末旅行陷困境
n13506534,母亲突然昏倒 2岁女儿独自拨打911求助
n13506498,数百辆车滞留暴雪中 卡车司机向受困者派面包
n13507006,新泽西化工厂大火警报11次 200消防员扑救
n13507146,汤加海底火山爆发 美对西海岸发布海啸警报
n13507183,美CBP用AI安检 两党议员担忧侵犯个人隐私
n13507332,【快讯】德州犹太教堂爆绑架事件 特警队介入
n13507560,盖茨：疫苗时效有限 Omicron或使疫情变成流感
n13509069,北卡购物中心停车场发生枪击案 3人死
n13509085,德州犹太教堂人质劫持案 嫌犯身份确认
n13509324,住院患者感染COVID增多 专家疑是院内感染
n13509660,暴雪雷雪和龙卷风袭美东 2死近25万户断电
n13509556,协助调查德州教堂人质事件 英警方逮捕两人
n13510061,美国养老院染疫和死亡数再次上升
n13510059,联邦卫生总监：Omicron未见顶 未来几周艰难
n13509866,新年前两周 7餐厅因卫生不达标停业整顿
n13511194,神韵第10次莅临匹兹堡 州长联邦议员齐褒奖
n13510556,目睹三儿童掉入冰池 23岁女子英勇跳水救人
n13511430,辉瑞CEO：COVID将传播多年 今春生活恢复正常
n13511781,冬季风暴席卷美加 美东数千航班被取消
n13511891,洛城护士遭无家可归者袭击后死亡
n13511778,德勤女高管被推下纽约地铁身亡 警方确认身份
n13512017,美上诉法庭裁决 德州高院审理堕胎诊所诉讼案
n13512347,“激活勇气”大会：重振美国价值观
n13514014,纽约市一公寓楼起火后爆炸 至少一死
n13513955,担心5G干扰 国际航空公司取消部分飞美航班
n13514139,美国多州COVID感染病例数急剧下降
n13514296,24岁UCLA研究生被刺杀案 悬赏25万美元缉凶
n13514396,税负翻倍换得全民健保 加州新提案好吗？
n13514244,专家：美国司机或在春季领略油价上涨压力
n13514869,世卫：Omicron后恐还有新变种
n13514867,美移民法庭积压案件创历史纪录
n13515780,拜登将提供4亿个N95口罩 美国人可免费领取
n13515168,打破医生预言 美国瘫痪女孩重新学会走路
n13516239,“我有一个梦想”费城庆祝马丁·路德·金日
n13516322,美国免费分发N95口罩 何时何地如何得到
n13516362,UCLA女大学生被刺身亡 凶嫌系逃犯 多次袭警
n13516894,15岁帕萨迪纳男孩遭枪击重伤
n13516908,洛杉矶铁路盗窃问题持续 员工受威胁
n13516995,诈领医保 洛杉矶药局被判罚440万美元
n13516782,美两大电讯商暂缓部署5G 仍有数百航班被取消
n13518961,重罪轻判、治安恶化 警察吁社区“守望相助”
n13519123,民调：大多数美国人支持美军协防台湾
n13519010,橙县沃尔玛警察捉贼 一嫌犯中枪
n13518959,美FAA批准更多机型在低能见度下着陆
n13519440,药剂师：轻抹鼻孔的COVID采样没用
n13519489,首次购房者 最高可获一万美元过户费补助
n13519542,加州减排政策和燃油消费税推高油价
n13519620,XPO物流公司的双港卡车司机想成立工会
n13519267,美高院再拒堕胎诊所要求 维持上诉法院裁决
n13520103,美国男子坚持20年 终买回已故母亲的老爷车
n13520977,新泽西州长签新法 户外偷窃包裹由轻罪改重罪
n13521403,赖清德出访过境洛杉矶 没有侨宴
n13521301,新泽西州长签堕胎合法新法案 保守人士反对
n13521422,窃贼驾摩托车高速撞车身亡
n13521642,研究：近37万加州人或缺安全饮用水
n13521674,加州提案：未成年人接种疫苗无需父母同意
n13521535,摩根士丹利CEO年薪增至3500万美元
n13521582,FBI：德州教堂人质事件是仇恨犯罪及恐怖行为
n13521824,纽森查看铁路盗窃现场：如“第三世界国家”
n13521882,国税局：2022年报税时需记住五件事
n13521847,大马男子法拉盛因车祸昏迷 被误传身亡
n13521845,国税局提醒报税季要注意的5件事
n13521925,2022年纳氏浆果农场“花生”庆祝活动已开始
n13521853,纽约州新冠阳性率 上月底来首降至10%以下
n13521843,亚裔妈将两童独自留家 被起诉
n13521827,私人停车位改装载区 湾脊区社委：分阶段测试
n13521935,276部电影有资格获奥斯卡提名
n13522893,美房产市场继续走俏 2022年买房将更难
n13516581,中西防疫政策对比 专家：中国或将面临巨大危险
n13523292,加州野火肆虐导致高速公路关闭 数百居民疏散
n13524739,《沉默呼声》华府上映 观众：真实 震撼 感人
n13525071,美国航空因疫情削减机上服务 包括餐饮
n13526303,组图：美国民众华府游行 抗议政府疫苗强制令
n13526945,美邮寄家用检测试剂 药店备好免费N95口罩
n13527044,南加家庭聚会枪击案：4死1重伤 枪手在逃
n13527407,南加天然气价格翻倍飙涨 省钱有窍门
n13528148,获悉搭车老妪八十大寿 两热心男请吃生日餐
n13528094,组图：奇特的自然沙雕惊现密歇根湖沿岸
n13528604,观众反响热烈《沉默呼声》全美加场一周
n13529503,新泽西新法：禁止使用花生状泡沫塑料填充物
n13529496,震撼观众心灵 《沉默呼声》全美加演一周
n13529349,纽约面临低温寒流 周末可能有风暴来临
n13529727,加州议员提案：禁一次性电子烟和香烟过滤嘴
n13529978,疫情困扰民众良久 医学专家在线答疑
n13529798,公众迟疑 美国COVID加强针注射进展缓慢
n13529861,暖心 美足球教练派遣队员免费帮社区铲雪
n13530089,德州女警从燃烧汽车内救出昏迷乘客
n13531114,传递善良 新世纪贺岁片《聚会II》获好评
n13531327,州参议员赞《沉默呼声》表达 “今天看不到的力量”
n13531709,SoFi体育场超级碗LVI球迷将获KN9口罩
n13531772,向犹太教堂人质劫持者售枪 德州男子被控罪
n13532099,日产SUV存在起火隐患 北美召回近80万辆
n13532276,美国医生组织用低价药治愈15万染疫者
n13532704,冬季风暴周末侵袭美东北部 降雪或逾1英尺
n13532697,目击者正确施救 心脏骤停男子奇迹生还
n13533936,华盛顿DC发生枪击案 多人受伤
n13534379,科比‧布莱恩特坠机两年后 照片诉讼案将开审
n13534422,新泽西鼓励种植本土植物 有哪些重大好处？
n13534384,拜登2月底前提名非裔女性接替布雷耶大法官
n13534549,世界自由集会 宾州民众表达对疫情强制令的担忧
n13534453,普林斯顿大学宣布：研究生津贴增加25%
n13534297,纽约市周六或遇强降雪 厚度可达20英寸
n13534827,美国税局第三轮纾困金发送完毕 未收到怎么办
n13534994,光天化日枪口下 南加护士劳力士表被抢
n13534423,盗贼洗劫加州集装箱货物 枪支失窃引担忧
n13535304,洛市县被勒令：提出无家可归者危机方案
n13535206,学生没见过雪 美国教师请人从外地寄来雪人
n13535772,安徽孤儿变身滑雪健将 代表美国征战奥运
n13537343,FAA批准两大电信商启用更多5G信号塔
n13537703,百万美元彩票大奖3张花落南加
n13537831,河滨国会议员提每周工作4天法案
n13537469,美国税局拟在其官网接入ID.me面部识别系统
n13537925,Omicron推动 美国死亡人数超过Delta感染潮
n13538138,研究：山狮成功地避开洛杉矶住宅区
n13538108,美国男子在海军基地方向拍到UFO 越变越大
n13538460,F-35C战机坠入南海照片曝光 美军设法打捞
n13538680,一氧化碳半夜泄漏 狗狗及时唤醒主人救全家
n13538609,美国女警数日内相继救回两个婴儿的生命
n13539426,2022退休？美国十个州堪称最佳去处
n13540478,研究：染疫痊愈获得自然免疫力 将持续18个月
n13540441,纽约两护士被控出售假疫苗卡 牟利逾150万
n13540484,SpaceX太空游中奖者体重超标 忍痛让票给朋友
n13542679,熟门熟路？  嫌犯11天内4次抢劫同一店铺
n13543152,来电显示均造假 2021年SCE用户损失重
n13543037,拉斯维加斯司机闯红灯 6车相撞致9死1重伤
n13543828,市议员黄敏仪派发新冠居家检测盒
n13543621,暴风雪袭击美国东海岸 纽约至少三人死亡
n13543805,应对商业行窃抢劫 白艾荣建“曼哈顿小企业联盟”
n13543811,华人热议警察葬礼：市民尊敬并感谢他们
n13543808,“全球华人新年晚会——神韵晚会”今明两天在新唐人电视频道播出
n13543833,暴风雪挡不住 纽约法轮功学员坚守真相点
n13543825,完全接种率逾七成 市府推新冠口服药送到家服务
n13544238,暖心 获救流浪犬每天趴门外痴等恩人回家
n13545059,新世纪影视配乐诗朗诵《二零二二新年贺词》
n13544011,史上首位双截肢者完成环球航行 历时7.5年
n13545351,美FDA全面批准莫德纳疫苗的使用权
n13545426,美国最受欢迎搬家目的地 通货膨胀严重
n13545635,击败49人队 公羊队将在主场打超级杯LVI
n13546041,T-Mobile要求办公室员工必须注射疫苗
n13546288,涉殴打及语言攻击 布碌崙休班警官被控仇恨犯罪
n13546204,纽约市警2月仍不打疫苗 将被解雇
n13545567,纽约市将警察接种疫苗最后期限推迟到2月
n13546012,专家：需警惕Omicron亚变种BA.2高传染力
n13546197,卡车司机向华盛顿进发 抗议强制疫苗令
n13546902,北卡一化肥厂火灾 恐发生爆炸 数千人撤离
n13547030,研究：Omicron传播快 染疫后也难阻再感染
n13546557,求职屡遭拒 美高中生成功创办数字营销公司
n13547325,以假换真诈骗苹果店 中国男子被判坐牢
n13547406,辉瑞向FDA申请授权 将疫苗用于5岁以下儿童
n13547722,继火车货柜遭劫 洛县邮递车窗被砸邮件被盗
n13547901,纽森贾西迪体育场不戴口罩 洛监事促重估强制令
n13547469,美国交通事故死亡人数激增 创历史新高
n13548172,拒绝中共 全球超43万人连署
n13551125,CNN老板辞职 称未披露与女高管亲密关系
n13552140,未获足够支持 加州全民医保法案被撤回
n13551974,美情报部门：外交官神秘疾病或为电磁能攻击
n13552487,美路管局新指南：各州获补助装测速摄像头
n13552338,花岗岩外墙部分脱落 法拉盛一房东被罚六千元
n13552319,警察莫拉葬礼 家属质问：还要死多少年轻人？
n13552353,纽约市休班警察深夜遭开枪 工会主席抨击
n13553745,震撼心灵影片《沉默呼声》2月4日至9日洛杉矶加演12场
n13554118,美医生讲出与主流疫情不同的看法而被调查
n13554336,49人队球迷SoFi体育场旁遭袭后昏迷
n13554569,法拉盛商改区新春庆祝活动 2月7日登场
n13554577,纽约市午后或降冻雨 留意路面湿滑
n13554553,法拉盛枪杀华男案 庭审延至10日
n13554551,2022年杰出亚洲艺术家颁奖典礼
n13554548,总统到访 纽约团体吁放弃扩大监视等治安措施
n13554304,与主流疫情说法相悖 医生面临被吊销执照
n13554707,黄敏仪选区办公室 7日起完全向选民开放
n13554695,皇后区地检庆黄历新年 台湾会馆副理事长获颁奖
n13554720,2022劳动力短缺持续 医疗行业尤甚
n13554690,电商网站成盲人提吿主要目标
n13554499,亚马逊2月18日起提高Prime会员费
n13554590,窃贼闯入民宅没偷财物 还留钱赔偿窗户损失
n13555025,枕头战变成正式运动 美国佛州举办首届比赛
n13555294,中共侵犯人权 前美花滑冠军质疑北京奥运
n13555833,拜登延长太阳能板关税 同时放松部分条款
n13556024,在SoFi体育场打伤49人队球迷 男子被捕
n13555768,新研究：血液测试可预测COVID感染程度
n13555939,研究发现疫情封锁措施无效 遭美欧大媒体封杀
n13556004,被解雇药厂员工解释为何拒绝接种疫苗
n13556347,备战超级杯冠军赛 美海关部署货柜扫描技术
n13556144,美国COVID-19疫情死亡人数超过90万
n13556454,生长国家有别 反共心声相同
n13556580,参议员约翰逊第三次疫情应对座谈会（一）
n13556466,接种疫苗后出现并发症  24岁纽约州大学生死亡
n13556329,纽约南布碌崙一空房爆炸 疑煤气泄漏引发
n13557417,美国东海岸遭遇另一场冬季风暴
n13558049,报复朝鲜骇客攻击 美国男子让该国网路瘫痪
n13558542,暖心之举 美国夫妇到大学校园免费送拥抱
n13559117,鸟撞激增 疫情给全球航班带来意外安全问题
n13559149,新泽西州共和党提诉 要求宣布新国会选区无效
n13559706,洛杉矶著名景点迎虎年 民众盼传承传统文化
n13559937,伊利湖浮冰断裂 美海岸警卫队救出18受困者
n13559611,专家建议取消疫情限制 为解除口罩令打开门
n13560088,美国警察代殉职同事在婚礼上与其女儿共舞
n13560305,组图：银河星空下的新墨西哥州砂岩地貌
n13561016,新泽西下月结束学校口罩令 特拉华州将跟进
n13561008,COVID检测呈阳性 美华裔花滑运动员退赛
n13561880,汽油价格再创新高 南加民众无奈接受
n13562465,COVID早期在家治疗有效 顶级医护纷发声
n13562116,冲浪城马拉松赛恢复传统日举行
n13563853,美查获值36亿美元的失窃比特币 金额创纪录
n13564291,贾西迪称不知幕僚性骚扰 前助手控其作伪证
n13565972,冬奥女子雪板障碍赛 雅各贝利斯为美夺首金
n13566384,疫情减缓 纽约州取消公共场所室内口罩令
n13565139,七旬老妪摔倒在冰路上 热心邮递员帮忙扶起
n13566676,超级杯临开赛 美国土安全部启最高风险评估
n13566822,春季将至 美国房屋销售比以往任何时候都快
n13566702,美招生舞弊案最重判决 前赌场高管获刑一年
n13567153,铁路货运公司和洛县地检商讨劫窃案防治
n13567149,辉瑞料今年疫苗及药物销售额达540亿美元
n13567958,美国老翁默默行善 替每个邻居把垃圾桶归位
n13568532,新泽西籍水兵在海豹突击队“地狱周 ”训练后死亡
n13568278,空中技巧混合团体赛 美国队夺冠精彩瞬间
n13568933,2月9日南泽西大地震动 原因成谜
n13568875,内华达州宣布撤销口罩令 立即生效
n13569032,洛县法院14日全面恢复陪审团审理
n13569357,橙县翡翠火引发疏散 延烧145英亩
n13569392,美国前职业橄榄球球星：抗拒在假货上签名
n13569434,美查缴近亿美元超级杯假货 多来自中国
n13569194,民调：四分之三美国人支持监管科技公司
n13569409,美国抵押贷款利率再飙升 为两年来最高水平
n13569787,神秘深海鱼再现加州海岸 头部透明长相怪异
n13570101,美国男子敞开心扉 成功救下欲跳桥青年
n13567870,房屋夜里起火 新领养狗及时救主人全家逃生
n13570170,组图：美国南加州野火肆虐 烧毁至少150英亩
n13570912,参议员提法案 拟迫使脸书改变算法
n13571255,惠蒂尔火灾致3住宅毁损 纵火嫌犯被捕
n13571530,美国税局最新数据：今年退税额低于去年
n13571343,美国医疗总监：随着疫情改善 应撤销限制
n13571723,洛杉矶动物园安乐死25岁高龄熊
n13570699,谷歌搜寻显示 这10种工作最多美国人想做
n13571746,为何电费一直涨？可以这样省钱
n13571792,行为不拘小节 易触刑法定罪
n13571842,气温升高致圣谷蚊虫孳生 当局吁防叮咬
n13571874,2月14日 天景购物中心邀您共度浪漫情人节
n13571851,纽约市第三个新冠专科社区医疗中心开业
n13571843,14日起 皇后区提供免费新冠居家检测盒
n13571848,BBB警示：小心情人节各种骗局
n13572468,口罩令取消 美国小学生回应 动人视频疯传
n13572268,彰显尊老传统 年轻人执意为陌生老人付油费
n13572668,骑车走遍美国 纽约男子：再次找回自豪感
n13573067,美国中大西洋地区及东北部超级碗周末有降雪
n13573202,仅凭嘴说 美军士兵二战时劝降1500名日本兵
n13573203,瑞士将投票决定成为首个禁止动物实验的国家
n13574203,超级杯开赛 外州球迷难挡洛城“热”情
n13574349,超级杯即将开赛 加州继续保持卫生紧急状态
n13574812,医护吁：解除医院对COVID治疗束缚 挽救生命
n13574941,洛杉矶公羊队夺得56届超级杯冠军
n13575556,天降神秘液体 美国拉斯维加斯居民不知所措
n13575610,对抗通膨 美国餐厅在菜单上发挥巧思
n13575721,美国男子历时三月 拍摄极稀有的黑冠黄雀鹀
n13576467,新泽西新海中校和台湾华语文学习中心 线上热闹迎虎年
n13576455,华盛顿特区市长宣布 将取消疫苗令和口罩令
n13576924,骗情玩浪漫 骗钱玩消失 律师谈网骗实例
n13576809,情人节民调：86%的美国人相信存在真爱
n13577254,超级杯冠军公羊队周三将在洛杉矶游行
n13577174,福奇：部分人每5年或需打一次疫苗加强针
n13577525,州监狱内阴谋诈领2,500万失业金 8人被起诉
n13577705,超级杯大赛期间 天空现大型“自由”信息
n13578200,中学生险被车撞 美国警察奋不顾身将其救下
n13579225,塑料袋即将禁用 宠物主人准备好替代物了吗？
n13579488,美最热房地产市场 外地买家比本地人多付30%
n13579506,感染病例下降 美更多州及地方取消防疫限制
n13580043,积雪快速消融 加州旱情仍持续
n13579705,美国3G网络即将关闭 不只老式手机受影响
n13580115,加州男子被控攻击美航空乘人员
n13580083,硫磺岛幸存的美国老兵 走进咖啡馆讲爱国故事
n13581784,美最大县开始放松限制 洛杉矶解除室外口罩令
n13582455,比弗利山连续抢劫案 3嫌落网4人在逃
n13582418,百万豪宅正成为美国房地产市场的新常态
n13582599,跟踪到家抢劫案 一嫌被捕两人在逃
n13582689,上万球迷洛杉矶游行 贺公羊队夺超级杯冠军
n13582933,网骗案例 招聘送钱画饼 汽车开走无还
n13585394,观《沉默呼声》共鸣深 华裔企业主捐万金
n13585540,纽约市屡发攻击亚裔案 新泽西亚裔社区担忧
n13585511,强风暴将袭美中东部 上亿人面临恶劣天气威胁
n13585790,加州卡车司机将组队赴DC 要求公民自由
n13585988,低收入者2022年可获得更多税收抵免
n13586203,大学招生舞弊案最重判决 麻州富商判监15个月
n13586204,加州将推出“地方性流行病”防疫计划
n13586206,加州议会提议法案 拟在街道安装测速摄像头
n13585660,FBI警告：SIM卡交换诈骗案激增 用户损失惨重
n13583575,组图：神奇壮观的荧光绿色 照亮华盛顿州海滩
n13583930,曾为警察祈祷而走红的大学生成为陆军军官
n13586696,两次遭解雇 27岁男将十项副业变成红火生意
n13588242,疫情挑战Airbnb生意 房东叹利润大跌
n13588402,加州宣布“SMARTER”计划 与病毒共存
n13588522,性骚扰处置质疑声中 加州州大总校长辞职
n13588483,诈领超时加班费 54东洛杉矶公路巡警被起诉
n13588620,企业留任员工减税额不菲 可追至2020年
n13588560,纽约市“地铁安全计划”九点细节公布
n13587649,美国警车遇“横祸” 被飞来轮胎砸破挡风玻璃
n13589090,美FDA警告：Family Dollar商品或被鼠粪污染
n13589210,15万张照片合成的超高清太阳照 罕见壮观
n13588914,男子发明“会长大的鞋” 给贫困儿童带去希望
n13590246,专家警告：油价或很快达到每加仑7美元
n13590260,一直升机坠入迈阿密海滩附近海面 两人受伤
n13591281,夏威夷出现UFO 美军F-22战机升空拦截
n13592453,新泽西亚镇推翻大麻种植计划 围绕大麻争议不断
n13594035,小球迷失去父亲 NFL球员陪她参加父女舞会
n13594664,新泽西中心城市致力探索新技术 服务居民和游客
n13594974,拜登宣布延长COVID疫情国家紧急状态
n13595222,遏止车辆转化器偷盗 尔湾新法下警方逮人
n13595261,杭廷顿滩直升机值勤中落海 1警殉职1受伤
n13595312,加州展开打击人口贩卖特别行动 逮捕近五百人
n13595810,扎营公园湖滨 无家可归者生活多面观
n13595849,手机用户投诉 被额外收取国际通话费
n13597135,2022年全国受教育程度排名 新泽西位居第六
n13597313,NBC北京冬奥转播获数十年来最低收视率
n13597611,美CDC：疫情期间少女因心理疾病急诊剧增
n13597787,为何想在这工作？ 职场专家告诉你最佳答案
n13597892,卖房子赚了钱？如何在报税季避免税收暴涨
n13599464,罗格斯大学推出新计划 数千学生可减免学费
n13597859,“疫情中更该看神韵”纽约神韵票热卖中
n13600219,纽约市长：几周内将取消疫苗强制令与疫苗护照
n13599975,在山姆店持刀砍伤华人 包括6岁童 凶手认罪
n13600520,比弗利山庄COVID检测点遭抢劫
n13600230,美国房市没有放缓迹象 买家竞价大战更激烈
n13600666,亦车亦家可办公 房车生意方兴未艾
n13600006,罗格斯大学募捐 纪念遇难韩裔女毕业生李尤娜
n13600505,冷暖空气相互冲突 美各地面临危险冰暴天气
n13601291,神韵重返内华达州 州长联邦参议员褒奖欢迎
n13600772,德州州长下令调查儿童变性医疗程序
n13601497,空军爸爸最后一次飞行 年幼子女机场送惊喜
n13601544,美国宝宝于2022年2月22日2:22降生
n13602770,新泽西居民组车队 参与全美司机抗议疫苗强制令
n13602752,疫苗宗教豁免申请被拒 空军军官起诉拜登政府
n13603063,新州新海中校台湾华语文学习中心举行揭牌典礼
n13603496,洛县周五起室内不用戴口罩 未打疫苗者除外
n13603352,美CDC将发布新指南 大幅放宽戴口罩要求
n13603587,边旅游边工作 高薪旅行护士职业走俏
n13604266,七十万分之一概率 乔州妈妈自然怀上四胞胎
n13605785,美CDC发布新指南 70%美国人无需戴口罩
n13606007,美CDC：Omicron致接种者感染和住院率激增
n13606046,医学家云集 谈自然免疫和接种疫苗免疫（上）
n13606098,医学家云集 谈自然免疫和接种疫苗免疫（中）
n13606134,政策后续不良效应显现 新泽西现“教师荒”
n13605956,纽约地铁现上百流浪汉营地 市长：全部拆除
n13606018,CDC数据：2020年美国出生率创历史新低
n13606384,长岛铁路、都北铁路25日起推出优惠票价
n13606374,纽约长岛市地铁深夜传暴力抢劫 五旬妇遭锤头
n13606367,图片新闻：雄鹿闯入石溪大学教室
n13606364,新州奥巴马健保注册人数创新高
n13606355,Walmart超市未列押瓶费 挨罚
n13606371,纽约民选官员及各团体 谴责俄罗斯入侵乌克兰
n13606194,研究：接种年轻人现罕见多系统炎症综合征
n13607579,州议会大厦改规定 无须疫苗证明或病毒检测
n13609296,亚马逊拟在新泽西加洛韦镇建新仓储发送站
n13609240,在美乌克兰人好莱坞集会 吁停战重归和平
n13610290,研究报告：纽约市交通拥堵全美第一 世界排名43
n13610287,州长：全州学校本周三解除室内口罩令
n13610127,基于信仰 德州父母收养经历坎坷的三兄妹
n13613088,医学家云集 谈自然免疫和接种疫苗免疫（下）
n13612790,电影业等待《铁锈》调查结果 枪支安管基本未变
n13614583,职场成功 传统四年大学还是唯一途径吗？
n13615008,橙县男子将指挥首次私人宇航任务
n13615902,美国男子吃蛤蜊吃出珍珠 价值或有数千美元
n13617034,美退役伞兵加入国际军团 帮乌克兰抵抗俄军
n13617198,拜登新疫情计划：让美国人回到更正常生活
n13617757,参与团伙劫窃 安纳罕女子获判一年监禁
n13617974,政策更新 洛市警察将需解释“借口”拦截
n13618018,仿冒团伙遭罚360万美元 6男被禁足时尚区
n13618249,曼哈顿街头 金发男两小时连袭七名亚裔女
n13612287,美弗州众议院决议 谴责中共迫害法轮功
n13620325,入室抢劫 洛杉矶8旬翁遭枪杀
n13619413,女儿婚礼上 父亲一个温馨举动让全场落泪
n13620596,克利夫兰国家森林野火继续燃烧
n13622847,新泽西韩国侨团举办“三一节”庆祝活动
n13622804,美高院裁定 恢复波士顿爆炸案罪犯死刑判决
n13623219,南洛杉矶市获拨款 栽植1,600棵树木
n13623526,纽约州保释改革为何争议如此大？
n13623512,闯红灯激增 2月份车祸死亡14年来最多
n13623509,打击防疫相关诈骗 州议会提案增罚款力度
n13623474,舒默孟昭文呼吁 基建资金优先建设地铁电梯
n13622361,纽约市将取消校园口罩令与室内疫苗令
n13623383,参议员约翰逊要求CDC公开“口罩研究”相关文件
n13623472,《他们是谁的孩子？》纪录片即将公映
n13624002,向聋哑公婆表尊重 新娘用手语说结婚誓词
n13624582,中兴通讯或违反美缓刑规定 3月14日出庭
n13624862,拜耳公司高管：mRNA疫苗是基因疗法
n13625590,龙卷风摧毁美蜡烛厂 囚犯废墟中救人受表彰
n13626547,美爱荷华州遭龙卷风袭击 至少七人死
n13627277,洛杉矶民众声援乌克兰 抵制专制扩张
n13626706,纽约官员：地铁安全对经济复苏至关重要
n13627635,外国男子在纽约丢皮夹 取回时4千美元未丢
n13627866,重症养子找到人生第一份工作 母亲超欣喜
n13629274,周一 美逾4700万人面临严重风暴风险
n13629347,佛州将率先建议健康儿童不要接种疫苗
n13629305,美海关查获230枚中国伪造总冠军戒指
n13630061,南加主要超市员工合同到期 罢工危机或重现
n13629950,残疾人提告纽约恩平同乡会 向每人索偿
n13630338,美国妈妈双子宫同时怀孕 22周诞下超早产儿
n13631310,法轮功学员被迫害致死 美委员会吁美制裁中共
