n13032433,纽约市办公室返工率 落后全美十大城市
n13032428,班森贺11社委会：新市长上任前暂停庇护所计划
n13032419,纽邮民调：选民首重治安 反对撤资市警
n13032414,布碌崙大桥自行车道开工 秋季完工 关闭一车道
n13032402,帮助年轻游民自立 纽约市将每月发1250元
n13032412,纽约大中央车站凯悦酒店新建工程重启
n13032479,公校户外毕业典礼人数 纽约市府解除限制
n13032482,纽约国会议员孟昭文 为毕业生举办户外毕业庆祝典礼
n13032956,【马克时空】中美军力对比系列 航母差距有多大
n13033224,融入美国社会 华人做义工获认可荣誉证书
n13033217,美国少年为学校绘制巨大国旗 以便同学宣誓
n13033786,热带风暴席卷美墨西哥湾沿岸和东南部
n13033801,拜登：美国不会因Delta变异病毒重新封锁
n13034080,被小狗从湖中救起 小鹿隔天前来道谢
n13034826,男子每日步行5英里上班 陌生人善举扭转困境
n13034819,亚马逊送货员帮助一对祖孙逃离失火房
n13035330,热带风暴酿祸？阿拉巴马州15辆车连环撞 逾10死
n13035360,佛州实验室在学生口罩上发现危险病原体
n13035498,纽约疫情后第一家 皇后区夜市开幕
n13035826,父亲节的来历和写给父亲的话
n13035898,5G发展高速传输同时 也带来潜在危害
n13036448,96岁老兵跋涉近千英里 祭拜救他命的战友
n13036984,维护第二修正案 密苏里夫妇亮新枪 网友热赞
n13037305,美欧宇航员太空行走 为太空站安装太阳能板
n13033876,大火吞噬汽车数秒前救出司机 美童子军获奖
n13037319,克劳德特在阿拉巴马酿13死 再成热带风暴
n13037631,防治野火 加州今年将花五亿美元清理森林
n13038039,报告：黑客曾侵入系统 试图污染旧金山饮用水
n13038939,出生时存活率0% 世界最早产婴儿庆1岁生日
n13039543,麻州近四千完全接种疫苗者 病毒检测呈阳性
n13039794,27学者曾驳病毒阴谋论 多人改口柳叶刀更正
n13038751,美国好心路人协助警官 成功阻止妇女跳桥
n13039303,柳叶刀一委员会解雇和武毒所有关系的科学家
n13040160,目标提前实现 新泽西接种疫苗人数超470万
n13040352,新泽西议会通过法案 延长大西洋城接管权
n13040350,研究：因疫情居家隔离政策未能挽救生命
n13040473,加州极旱缺水 民众未来用水或再受限
n13040524,加州欲100%支付所欠租金 由联邦付款
n13040598,机场轻轨重站开工 连接Metro火车和LAX
n13040565,反对学校贴BLM海报 明尼苏达女孩网络爆红
n13040833,银行账户凭空出现10亿美元 美国女子吓坏了
n13041224,为了救主人 美国忠狗被有毒的响尾蛇咬伤
n13041811,【马克时空】首次太空修复行动 NASA抢修天空实验室
n13042166,巴菲特捐41亿 辞去盖茨基金会受托人职务
n13042079,肇事司机逃逸 警察合力将压在车下妇女救出
n13042268,佛州州长签法案：高中生要了解共产主义邪恶
n13041625,丈夫悄悄用三千硬币铺酒窖地板 妻子惊喜
n13042126,加州男子扮蜘蛛侠 帮助不幸的人
n13040108,谴责中共强摘器官 美费尔法克斯市通过决议
n13042720,美国华府295号洲际公路桥梁坍塌 酿6伤
n13042314,美CDC：疫苗致一千二百心脏炎症病例 高于预期
n13043083,休斯顿一医院153名员工拒打疫苗被解雇
n13043161,洛县将租客驱逐禁令延至9月30日
n13043093,美国儿童税收抵免 谁有资格获得3600美元
n13043475,全美租车难 租价飙升 汽车共享平台大热
n13043591,橙县监事会：是否有接种疫苗死亡事件？
n13043617,美国女子发现百年瓶中信 交还给主人的女儿
n13044640,【马克时空】中美俄载人飞船比较 未来发展为何？
n13044960,白宫与参院小组达共识 基建计划缩水一万亿
n13044859,【更新】佛州12层大楼倒塌 51人下落不明
n13044798,疫情下 美国雕塑家创作雪雕“希望天使”
n13045182,德州起诉拜登政府释放染疫非法移民
n13045639,佛州大楼倒塌 午夜遛狗人救出瓦砾下男孩
n13045776,《归途》斩获六十奖 新世纪新片《演员梦》开机
n13045947,羚羊谷大麻种植偷水猖獗 县监拟修法严惩
n13046014,您家夏季电费账单为何攀升？
n13046028,房市狂热 “地狱般丑房”60万还哄抢
n13046161,二手车车价暴涨 汽车成小偷主要目标
n13046098,40头待宰牛只逃跑 最后一只抓回
n13046693,《美国达人秀》惊现软骨功 老伯缩进小箱子
n13046482,【特稿】一场中共不想让您看的演出
n13046556,神秘顾客留1.6万美元小费 嘉奖餐厅员工
n13047363,专偷独角兽玩偶引关注 流浪狗找到幸福归宿
n13047857,佛州大楼坍塌 儿子：母亲前一天听到吱嘎响
n13046132,领失业金拒工作 新泽西企业面临用工荒
n13048342,明州弗洛伊德案 涉事前警察被判监22年半
n13048300,洛县警长建议宣布无家可归紧急状态
n13048277,美情报界报告确认144起UFO目击事件 143无解
n13048497,美国独立日长周末 南加出行预计约330万人
n13048723,密歇根州13岁男孩接种疫苗后死亡 CDC调查
n13048750,纽约市长移民办：法拉盛是最大移民社区
n13048711,枪击案激增 詹乐霞归咎走私枪支 非保释改革
n13048709,自疫情爆发以来 纽约重症病房患者首降至百人以下
n13048733,北太平洋暖流引发热浪 美西北部高温恐破记录
n13048909,从学校勤杂工到教师 美国43岁男翻转人生
n13049397,水牛城一户意外收到一百多包裹 引出温馨故事
n13049615,美热气球撞电线后着火坠落 4死1重伤
n13049760,麻州爆卡车撞房子和枪击事件 酿三人死
n13049797,四个迹象 美加边境或在7月21日重开
n13049347,【马克时空】中美驱逐舰对比 神盾系统成标配
n13049904,美西90%地区遇历史性干旱 影响5800万人
n13050021,美政府报告证实UFO存在 仍留下五大疑团
n13050262,iPhone手机坠河3天后被捞起 闹钟还在响
n13051377,佛州大楼倒塌事件 9人丧生 156人仍失联
n13052117,首次开口说话竟向妈求救 女婴救了自己一命
n13052356,佛州公寓倒塌 母亲重伤骨盆碎裂仍拉出爱女
n13053162,芝加哥发生火车与皮卡车相撞事故 三死
n13052909,美摄影师拍日偏食照片竟与草图完美吻合
n13053313,纽约州沃尔玛停车场枪案 1死3伤含15岁少女
n13053224,佛州警察帮助所需者 : 不能让人光着脚走路
n13053803,佛州大厦坍塌前 她致电丈夫：窗外泳池塌陷
n13053827,迈阿密-戴德县县长下令审计40年以上建筑
n13053222,美国前陆军训犬师与嗅弹犬重聚 场面感人
n13053910,罕见热浪袭美国西北部和东部 电费或猛涨
n13054246,机场安检人员短缺 美交通局招员工奖励上千元
n13054446,越战老兵爱国情怀 为了这个至今仍感自豪
n13054370,联邦和州政府诉脸书垄断案 美国法院驳回
n13054639,两妇女大华超市遭抢 圣盖博警方发视频寻凶
n13054854,美国男子在佛州拍到奇景 云层如波涛汹涌
n13055803,【马克时空】哈伯太空望远镜成果丰硕 近日故障或退休
n13055955,美两党基建协议拟替换全国含铅水管
n13056061,美墨边境危机持续 两州长跟进派兵支援前线
n13054484,承包商骗3.3万美元后 警察修复老夫妇屋顶
n13056238,佛州大楼坍塌 大三学生描述与家人逃生一刻
n13056555,贩售中国制假冒笔电电池 圣谷男子认罪
n13056521,美国威廉王县通过决议 抵制中共强摘器官
n13056453,新泽西医院11个月中共肺炎患者首次零死亡
n13056428,美最高法院裁定：被驱逐非法移民无权保释
n13056597,美汽油价格升至七年来最高 今夏或维持高价
n13056830,弃用雷达通过测试 特斯拉Model 3获安全认证
n13057043,独立日燃放烟花 执法机构提醒别触法
n13056991,暂停驱逐租户禁令 美最高院维持延至7月31日
n13054485,儿子奇迹存活 父亲靠信仰面对“最大恐惧”
n13058503,佛州大楼倒塌 检察官要大陪审团调查
n13057433,难忘亲子时光 爷爷转赠三代人玩过的旧棒球
n13058367,美大兵完全接种疫苗患心肌炎 病例高于预期
n13058581,美加西部遭遇历史性高温 多人因热浪死亡
n13057333,【拍案惊奇】百年党庆成闹剧 习近平紧张防变故
n13057491,相互支持 美41岁父亲和女儿一同大学毕业
n13058340,乔州女服务员 救出困在燃烧汽车中的女子
n13058866,亚马逊要求联邦贸委会负责人退出反垄断调查
n13058974,法国送独立日大礼：迷你自由女神抵达纽约
n13059016,宾州法庭推翻性侵定罪 老牌谐星考斯比获释
n13059070,洛市拨款1000万助租屋族抵御驱逐
n13059208,在西田百货遭持枪抢劫 受害人损失13.6万元珠宝
n13059263,风向转 洛杉矶市拟限制游民露营
n13059153,美国佛州塌楼搜救增致16死 147人仍失踪
n13059345,伊万卡夫妇低调为佛州塌楼搜救工作捐款
n13059757,洛城警方引爆非法烟花出意外 至少16人受伤
n13060147,失踪小狗自行返家 用鼻子按门铃告诉主人
n13060457,【马克时空】马斯克越挫越勇  SpaceX如何起死回生？
n13059277,退役老兵紫心勋章获得者 90岁生日圆跳伞梦
n13060771,佛州妇女被一股罕见力量惊醒 大楼坍塌前逃生
n13060272,母亲为儿子订生日蛋糕 竟收到感人匿名便条
n13061466,新泽西将出现一家全新折扣超市Grocery Outlet
n13061125,美最高院裁定：亚利桑那州收集选票禁令合法
n13059484,妈妈是学习第一动力 儿子与母亲毕业同一学院
n13061664,亨利福特: 美密州第一家要求员工接种疫苗医院
n13061921,独立日前夕油价创新高 加州油价全美最贵
n13062051,洛城警方引爆非法烟花出意外 17人受伤
n13062212,美国司法部下令暂停执行联邦死刑
n13062395,看到厨房起火及时通报老爸 4岁女童救了全家
n13062548,获两党官员和老兵支持 橙县军人墓地有望尽快建
n13062919,美国载有一家五口的汽车 连续遭雷击三次
n13062989,美国2岁童游泳遇险情 13岁少年果断施救
n13063667,独立日美国人纷纷上路 哪天驾车出行最好？
n13063616,律师：特斯拉近13万美元顶配汽车驾驶时起火
n13063771,美短跑女子冠军大麻检测呈阳 或无缘东京奥运
n13063809,波音737货机因故障坠海 二机师获救
n13063320,疫情间 少年用一千二百多小时建35英尺高堡垒
n13063669,犯罪激增 法官令明尼阿波利斯雇更多警察
n13064159,加州野火季存隐患 山羊防火队需求暴增
n13063843,艾尔莎成本季首个飓风 或途经佛州塌楼现场
n13064188,佛州大楼倒塌 一消防员7岁女儿不幸遇难
n13064243,【秦鹏直播】世界最知名猎手被猎 曾获中共颁奖
n13064249,7月4日长周末奔向海边 美旅行接近疫情前水平
n13064336,独立日防意外 警局抓超速罚酒驾
n13064349,独立日踏青防蚊 避免感染西尼罗河病毒
n13064371,组图：庆美国独立日 杭廷顿海滩市办多项活动
n13064594,311系统进入地铁解决游民问题
n13064584,在布碌崙联邦监狱前劫车抢小孩 嫌犯被捕
n13064589,“夏日街道”回归 8月的两个周末盛大举行
n13064497,市卫生局提请市民：将燃放烟花的工作留给专家去做
n13064663,走私玻璃鳗到香港 华男JFK被捕认罪
n13064932,佛州科企遭勒索软件攻击 200家公司受影响
n13065384,【马克时空】精确制导炸弹 现代战争的宠儿
n13065422,Delta变种来势汹汹 你需了解的五个问题
n13065504,武装对峙 美麻州I-95高速公路关闭
n13065466,美独立日周末 哪些商店和服务开门哪些关
n13065490,二手车售价高过原始新车出厂价的16款车
n13064915,离异父倒8万枚硬币当抚养费 母女善意回应
n13065666,波音737货机坠海 飞行员求救细节曝光
n13065762,美国人旅游需求强劲 航空公司和机场争聘员工
n13065836,因生活质量及安全问题 旧金山近半居民欲搬离
n13066141,等了60年 美国70岁女子一圆洋基球童梦
n13066438,民调：大多数美国人认为外星人存在
n13066667,纽约肯尼迪机场塔台漏水 数百航班受影响
n13066867,热带风暴向美海岸挺进 佛州宣布紧急状态
n13066784,消防专家遇难 三百多同事参加他女儿毕业典礼
n13067190,橙县冲浪城一连3天欢庆美国独立日
n13067033,泰森召回即食鸡肉产品 可能受李斯特菌污染
n13067221,疫情下房车走俏 预计将持续到2022
n13067571,【直播】独立日华盛顿DC国家广场烟花秀
n13067841,新唐人英文频道落地纽约和洛杉矶有线电视
n13068026,旧金山湾区摩根山国庆游行 观众喜爱法轮功
n13068453,美科企遭黑客索七千万美元赎金 白宫令彻查
n13068515,二战最年轻士兵 12岁男孩成美国海军英雄
n13068916,艾尔莎逼近 佛州拆除倒塌大楼残体 恢复搜索
n13068304,励志 美13岁少年经营卖柴生意且成绩优异
n13068593,奇观 潜鸟协助乌龟爬到自己背上齐晒太阳
n13068556,组图：美国璀灿烟火秀 庆祝建国245周年
n13068866,回馈社区 美警官义务帮73岁老妇修剪草坪
n13069722,洛杉矶烟花爆炸案 男子面临联邦指控
n13069578,传9月美军若强制疫苗接种 部分军人将退役
n13069991,独立日周末加州遭遇多场野火 火势猛烈
n13069816,美7月4日周末发生四百多起枪案 逾150人死
n13070192,烟花加野火 南海岸现空气质量警告
n13069992,美伊州老城独立日游行 法轮功队伍受欢迎
n13070117,分析：拜登税改令最富美国人多付156万美元
n13070397,独立日庆典 南加民众向英雄致敬
n13071139,身高210公分 世界最高的马在美国过世
n13071713,破纪录高温炙烤美西北 俄勒冈近百人死亡
n13071702,mRNA疫苗发明人质疑儿童接种效益 遭删账户
n13071494,家遇困境住车里 大学生克服万难顺利毕业
n13072220,男子曾被外星人绑架 对美政府UFO报告不满意
n13072491,【疫情中的纽约人】幕后英雄：最艰难的一年
n13072482,热带风暴艾尔莎逼近 佛州四百万人收到预警
n13072622,美国今夏汽油价格预计将上涨20美分
n13072815,NASA局长：正积极寻找宇宙中智慧生命
n13069938,独立日游行 华府法轮功学员五城传递美好
n13073586,组图：美环球航空800号坠机残骸即将被销毁
n13073926,热带风暴艾尔莎周三登陆佛州
n13071558,乔州警官辅导六岁无臂男童当“侦探”
n13071612,最后一位二战荣誉勋章获得者欢迎曾孙入伍
n13074514,川普宣布对推特、脸书和谷歌提起诉讼
n13074869,圣佛南多谷干道上 19商家窗玻璃遭击碎
n13074885,【疫情中的纽约人】“英雄峡谷”中的游行
n13074973,101高速三车连撞后 女子走出车外遭撞亡
n13074891,美业界和国会议员促白宫取消旅行限制
n13075126,洛县警长发豪语：非法大麻种植者末日到了
n13075139,费城庆建国245周年  彰显爱国与传统   
n13075148,再谈洛县建议“所有人都要戴口罩”
n13075501,宾州格兰赛德国庆日游行 法轮功腰鼓队受欢迎
n13075784,美国36州再告谷歌 指控Play Store垄断市场
n13075710,追随父母 非裔美国家庭六兄弟姐妹都成为医师
n13075871,妇女游泳险溺亡 美10岁童快速反应救回命
n13075909,【马克时空】两栖攻击舰 成中美角力战场
n13073861,漂流偶救溺水野马 几天后马儿奔向恩人
n13076392,治愈之旅：一岁猫咪随主人攀遍48座最高峰
n13077222,驳黑命贵仇恨论 纽约画家：美国国旗代表所有人
n13077410,企业招工难 青少年填补成人工职缺
n13077429,洛县青少年可获政府和私企带薪实习机会
n13077463,新一波热浪又到 羚羊谷可达113度
n13077374,联署病毒自然起源说新公开信 3科学家弃签
n13078880,加州和内华达州交界处发生6级地震
n13079018,热带风暴艾尔莎袭美东海岸 纽约市接洪水警告
n13078821,虚假评论加扩张 中国卖家占亚马逊商家一半
n13079539,76 万家庭将收到最高500美元退税支票
n13079545,阻5G进社区 地方团体吁抵制加州两电信法案
n13079145,美CDC鼓励秋季返校上课 不建议强制打疫苗
n13079561,面对物价上涨 美五口之家如何应付日常开销
n13079547,水陆两栖小飞机技术被盗走 美企状告中企
n13079817,图纳野火50%围控 马里布不再受威胁
n13079845,移民美国三十余载 华裔感叹变迁
n13079963,窃美巨头公司机密 华裔首席女科学家认罪
n13079552,新泽西拟出新法 司机需避让自行车和行人
n13079891,周末热浪来袭 美西南部高温料将破纪录
n13080072,新泽西疫情降温房市升温 房屋上市即有买家
n13079951,全球最大 纽约乐高乐园正式开幕
n13080131,印度Delta变种病毒 占纽约市过去四周新样本的26%
n13080141,纽约州中部破获两贩毒集团 起诉78人
n13080125,普渡制药与15州达成和解 纽约获2亿美元
n13080121,市议员顾雅明17日将免费送自行车头盔
n13080115,第六届皇后区夜市本周六起向公众免门票
n13079948,史坦顿岛酒吧业者提告纽约市警长办公室
n13079992,纽约市100个体育场周末晚上开放 为青少年提供运动场地
n13080345,与失踪10年的小狗团聚 美国男子落泪
n13080507,独立日感人瞬间 超市顾客自发齐唱美国国歌
n13080809,美国凤凰城遭风暴袭击 3万户断电
n13080818,美海关查获三千多对非法进口中国假睫毛
n13080092,儿10年飞行员生涯 父进驾驶舱同乘 画面感心
n13081092,法轮功纽约上州集会 国会议员：盼没有中共
n13081094,【新闻看点】美查获假睫毛 透露大陆劳工黑幕
n13081868,两女孩为殉职警察筹款带动社区 警官感动
n13082141,疫情解封 为何Uber和Lyft司机一直短缺
n13082162,【内幕】张高丽为何承认江泽民是活摘元凶
n13082339,英富豪完成太空旅行返回地球 视频震撼人心
n13082181,美左派促拜登为气候协议与中共暧昧 学者反驳
n13082550,兰开斯特高温达113度 周二后南加开始降温
n13082496,佛州塌楼事故遇难者升至90人 更多建筑被审查
n13083016,为了保护历史公园 夏威夷推乐透送山羊
n13083385,濒死游历天堂与地狱 美国男子戒酒回归信仰
n13082657,受偶像激励 美唐氏症少年完成迷你铁人三项
n13082702,感人时刻 警察压力下耐心安抚无家可归幼童
n13083835,南加州一群爱国少年在山上升起新国旗
n13084461,华为控告Verizon两项专利诉讼案 周一达和解
n13084296,美国物价飙升 消费者担忧 通胀预期创新高
n13084500,白宫：州和地方政府可用疫情救济金打击犯罪
n13084643,加州北部罕见火龙卷风 惊悚视频曝光
n13084730,本周发放新儿童税收抵免 国税局寻低收入家庭
n13084895,洛杉矶将成立“枪支走私打击部队”
n13084798,破纪录高温及野火肆虐 加州启用紧急措施
n13084960,加州野火创新纪录 官员：遇最严峻时刻
n13085045,法官批准UCLA狼医7,300万美元集体诉讼和解案
n13085079,南加州三男子伪造文件 面临判刑
n13085121,反迫害22周年 法轮功费城集会再揭中共活摘罪行
n13085234,美国民众叫外送 送餐点的竟然是警察
n13085700,美犹他州下“鱼” 数千条从飞机上倾泻而下
n13086161,16岁生子 被迫送人领养 71年后母子重逢
n13086587,今夏美家庭纷纷出门度假 这七个地方最实惠
n13087194,洛县决议关闭羚羊谷非法大麻种植
n13087561,美国奇男子 创下200项吉尼斯世界纪录
n13088279,国际宗教峰会专场“中共对法轮功迫害加剧”
n13088444,福来鸡连续七年被评为美国最受欢迎快餐店
n13088680,华府警告海地和古巴人 勿试图逃到美国
n13089102,橙县消防员救出被卡在墙中女子
n13089184,美2020年吸毒死亡人数上升30% 创历史新高
n13089417,加州车管局南加设点 为AAA会员发放Real ID
n13089590,洛县批5亿美元因应无家可归问题
n13089939,小金鱼野放美国湖泊 长成几十公分巨无霸
n13090060,橙县监事会恢复常态 对居民开放会议厅
n13090127,法男心灵感应与预知能力 震撼《美国达人秀》
n13091059,强生召回Aveeno和露得清防晒喷雾 含致癌物
n13090936,龙卷风袭击后 美警长和副手瓦砾中折叠国旗
n13091051,九旬二战老兵被迫住车里 善心夫妇募款帮他
n13091488,乔治‧弗洛伊德壁画被雷击摧毁 现三种说法
n13091997,加州女医生因伪造疫苗接种纪录卡被逮捕
n13092265,学生、家长忧秋季返校需施打疫苗
n13092359,美俄勒冈野火蔓延逾22万英亩 两千人紧急疏散
n13092230,前国会议员谴责迫害 唤醒人们摒弃中共
n13092202,中共迫害法轮功22年 前美宗教自由大使吁关注
n13092697,纽约公园杂草丛生 找山羊除草既环保又省钱
n13092945,组图：法轮功反迫害22周年 美国多地举行集会
n13092923,小狗走失10年离家千里 美飞行员驾机送它回家
n13093711,美二季经济增长好兆头 6月零售销售意外上扬
n13093029,建筑倒塌工人被埋90分钟获救 搜救犬立大功
n13093886,允许孩子未经家长同意接种疫苗 DC政府被诉
n13093053,男子每天步行四小时上班 警察善举扭转困境
n13094090,前美缉毒官：毒贩与华人罪犯合谋 输入芬太尼
n13093900,美国首都7·20反迫害集会 各界声援法轮功
n13094644,穿防弹衣携枪闯洛城联邦大楼 男子续被拘留
n13094283,反迫害22年 法轮功华盛顿游行吁结束中共
n13094603,组图：法轮功反迫害22年 美国首都烛光夜悼
n13094861,认识何为忧郁症 心理咨询师教健康应对压力
n13095049,组图：法轮功华府游行 吁共同制止中共迫害
n13095786,拥有10万英里以上里程的旧车 成了抢手货
n13094554,美西北和加拿大南部周末再遇酷热天气
n13096155,全美大部分地区恶劣天气将持续到周末
n13095296,爱的付出 高中校长亲笔赠言送459名毕业生
n13095326,女客被骚扰 调酒师机警递“纸条”解困获赞
n13096168,护照办理延误破坏了数百万美国人的旅行计划
n13096051,和戴琪不同调？耶伦称对华关税伤害消费者
n13096480,为了证明自己还活着 美国女子与政府缠斗7年
n13096316,拜登政府官员现在相信病毒从中共实验室泄漏
n13096604,野雁受伤在医院动手术 伴侣找上门深情凝望
n13096682,以1美元把发廊卖给员工 暖心老板：她值得
n13097361,美各界：中共迫害法轮功 犯下群体灭绝罪
n13097497,Delta变种快速成为新泽西的主要毒株
n13097529,强生公司中共病毒疫苗或致肌肉无力和瘫痪
n13097568,新泽西推出仪表盘 民众可查前十年交通拦截数据
n13097438,美各界觉醒 感谢法轮功助世人了解中共致命威胁
n13097411,加州州长纽森面临罢免 41人角逐特别选举
n13097629,斑点灯笼蝇再次入侵新泽西 官员下令“杀无赦”
n13097638,大型购物中心“美国梦”宣布近期将有更多门店营业
n13097789,22号公路超高速驾驶 警察严打违规司机
n13098018,夏季高温炎热 儿童被遗忘车内致死风险高
n13098166,纽约720夜悼被迫害致死的法轮功学员
n13098355,惊人画面：冒烟的汽车飞到空中再摔落路面
n13098757,洛杉矶法轮功学员720烛光夜悼 吁停止迫害
n13098843,【疫情7.19】英格兰今日起全面解封
n13092115,法轮功反迫害22周年 美15国会议员声援
n13099391,北卡退休男子与无家可归者成好友 送房给他
n13100087,众院通过法案 禁千人计划在美招募科学家
n13100293,洛县警长称不会强制执行新口罩令
n13100668,洛城各族裔联邦大楼前声援古巴 抵制共产专政
n13101097,南加SCE启动安装3.8万个电车充电机计划
n13100779,研究：维生素D可改善染疫者治疗效果
n13100480,纽约人创作“天使”雕像 授予年度法轮功之友
n13101424,【疫情7.20】研究：印度400万人死于瘟疫
n13101269,夕阳时分 摄影师用手机拍下梦幻般风暴云
n13101853,【更新】世界首富贝佐斯成功开启太空之旅
n13102228,报告：美25城砍警察预算 市府却享专警保护
n13102560,比尔盖兹与索罗斯资助收购COVID-19测试公司
n13102907,纽约联邦议员允诺帮助法轮功学员制止迫害
n13103088,加大要求学生返校前必须接种疫苗
n13102990,Delta变种病毒更具传染性 占美国新病例83%
n13103120,洛城警长：烟火引爆伤人案是人为疏失
n13103225,夏日谨慎泳池隐藏危险 预防水中触电
n13103001,俄勒冈州靴筒野火规模之大 形成独自气侯现象
n13103548,首次单飞时飞机失去动力 菜鸟飞行员镇定迫降
n13103817,收到刮刮乐当礼物 美国女子中了200万美元
n13103460,突遇爆胎母子困路边 警员免费帮换一套新胎
n13104714,加州养母帮助下 生母戒毒并重获女儿监护权
n13105630,美各界敦促政府追责中共活摘器官暴行
n13105501,不小心成渔夫网中物 罕见龙虾幸运回大海
n13105718,网约车司机周三全美发起罢工 盼获合法权益
n13105922,钜额失业金欺诈案 前联邦检察官加入调查
n13106221,大脚怪抱孩子渡河？ 美国男子拍到奇特画面
n13106187,全世界中国古典舞大赛9月初纽约举行
n13107467,接种疫苗后 新泽西近50人死于COVID-19
n13108073,两个月内第三次 全球出现大规模公司断网
n13108138,新泽西失业者获补贴 或有资格得近乎免费医保
n13108365,美安娜堡市被评为全美受教育程度最高城市
n13108506,洛杉矶两餐馆暂时关闭以应对COVID-19病例激增
n13105822,【疫情中的纽约人】“史坦威”钢琴之缘
