n12912734,洛杉矶 一个自由派城市的现状
n12913000,绝境中传出最后风景照 迷路登山客离奇获救
n12913404,年幼时重度烧伤 美国妈勇敢参加选美大赛圆梦
n12913961,佛罗里达众议院通过法案 禁止使用疫苗护照
n12914218,13小时对峙 北卡枪案五人死 含两警察
n12914193,美消费力惊人 推动首季GDP增长6.4%
n12914280,洛杉矶爆连环枪击案 华人优步司机遇难
n12914435,川普：考虑跟佛州州长搭档竞选2024年
n12909481,美自由之家记录香港大纪元和法轮功受袭
n12915165,人口普查结果 新泽西过去10年人口增50万
n12915195,新泽西州的REAL ID截止日期延长至2023年
n12915255,想去投票站投票？墨菲：必须佩戴口罩
n12915405,数百只鸟入侵美国加州民宅 如惊悚电影
n12915389,回应掩盖疗养院死亡数批评  库默：为数据准确性
n12915378,纽约市三大图书馆系统 5月10日起有限度重启
n12915651,全球唯一没有金色拱门的麦当劳店
n12915410,价值10万美元 纽约售票员捡到珠宝速归还
n12916447,美国参议院批准78岁纳尔逊领导NASA
n12916259,自闭症童之母为学校爱心管理员筹3.5万美元
n12916975,白宫宣布印度旅行禁令 5月4日生效
n12917074,民众可前往新泽西6大中心接种疫苗 无需预约
n12917046,拜登的宠物家庭将迎来一新成员
n12917052,疫情未现高峰 新泽西再放宽毕业典礼限制
n12917066,接到绑架报警 休斯顿警方在一房内发现90人
n12917290,积雪不足取消测雪 持续干旱影响今夏供水
n12917234,加州近20%电动车主为何想重开汽油车
n12917660,宾州男子替已故母亲投票 被判缓刑五年
n12917529,纽约市吸毒过量死亡增 市府加强预防与服务
n12917544,出售假“除菌片”华男被判罚1500元
n12917580,亚美医师协会荣获环保活动第二名
n12917575,纽约法拉盛5月2日举办反对亚裔仇恨集会游行
n12917552,名导今在纽约唐人街开拍监狱纪录片
n12917549,纽约为低收家庭提供空调补助 3日起开放申请
n12918152,九千多美国人接种疫苗后染疫 132死
n12918051,260磅美国女体重减半 圆梦成健康妈妈
n12918468,华盛顿州商场发生枪案 逾2人伤 嫌犯在逃
n12917146,五角大楼前官员：足够证据证实UFO真实存在
n12919070,【疫情5.2】法国医疗援助设备抵达印度
n12918790,美前参院领袖：军火巨头洛马或有UFO残骸
n12919517,纽时华邮及NBC撤回有关朱利安尼与FBI的谣言
n12919431,NASA逾50年首见 SpaceX载人飞船夜降大海
n12919679,印度吁放弃疫苗专利 美贸易代表将参加世贸谈判
n12919894,捕获率三千万分之一 蓝纹龙虾在餐厅被救下
n12919927,美议员提法案 限制世界银行向北京提供资金
n12919995,美圣地亚哥海岸人口走私船翻覆 3死27人伤
n12920254,难以置信 高中摔跤教练身价逾亿
n12920341,橙县监事关心疫苗二维码泄漏隐私
n12919934,美日警告不要擅改东海现状 向中共释何信号
n12920831,【疫情5.3】美国每日平均新增病例不足5万
n12920253,12岁男孩高中大学同时毕业 还办互联网公司
n12921468,佛州老妇疫情中善举 每周义务煮千人份食物
n12921965,龙卷风侵袭美国 一亿人面临强风暴风险
n12921903,不明飞行物事件日增 佛州男子目击两UFO
n12921377,Chick-fil-A员工帮龙卷风中挣扎的同事 获表彰
n12921811,白宫顾问：全球最低企业税可抵销国内增税影响
n12922188,【快讯】美亿万富翁比尔·盖茨离婚
n12922039,拜登宣布难民限额增四倍 接纳6.25万人
n12922247,佛州暂停所有疫情限令 州长：不再有紧急状态
n12922563,朱利安尼：FBI凌晨突袭公寓 试图构陷
n12922572,中央公园法轮功炼功点 纽约人相继而来
n12790823,强生疫苗生产面临问题 默克公司将协助生产
n12792357,监测机构：风暴期间德州电网运营商超收160亿
n12793299,开止痛药致五人死 长岛医生被控谋杀
n12793185,德州州长支持立法 禁止社交媒体言论审查
n12793867,德州天然气爆炸起火 多人受伤
n12793440,拒捕遭逮陷惊恐 女嫌犯拥抱善意警察 翻转结局
n12794073,中国黑客侵入微软系统 白宫：用户须立即修复
n12794061,在美国62岁领取社安福利的三个原因
n12794422,绑在车后的大粉色毛绒熊 揭司机驾车警觉度
n12794498,拜登：1400美元纾困支票本月开始发放
n12794634,美资深记者：习近平将我逼成了对华鹰派
n12794587,参议院两党交锋 共和党仅守住3项纾困修正案
n12794335,报告：美国966人接种新冠疫苗后死亡
n12795145,姨父手臂刻有数字 背后故事震惊犹太女
n12796373,旧金山湾区真相汽车游行 市民盼解体中共
n12796027,停水停电 美国母亲妙用龙虾锅为孩子洗澡
n12797600,【名家专栏】面临毁灭的产业和政治投票联盟
n12797950,面向中共病毒疫苗接种人群 美CDC发布指南
n12798462,富士康未建威州面板厂违约案 原告撤诉
n12798677,乔州参院通过改革法案 终止无理由缺席投票
n12798709,连续589天 美国男子捡光健行步道的垃圾
n12799094,美议员提法案 可起诉发动网攻的外国政府
n12799297,历经70年 美国韩战老兵家书回到亲属手中
n12799381,【疫情3.9】欧盟：不会将疫苗用于宣传目的
n12799862,拜登爱犬白宫咬人 被送回特拉华州老家
n12799298,爱犬命悬一线 加州男徒手击退三百斤黑熊
n12800344,回应中共人身攻击 蓬佩奥：因击中其要害
n12800492,因食物问题肠胃不适 50国民警卫队员就医
n12799985,【名家专栏】奇特的美国“种族主义”
n12801032,五角大楼：国民警卫队将留守国会大厦至5月
n12800956,阿肯色州州长签署法案 全面禁止堕胎
n12801372,如何因应僵尸攻击？ 美国CDC告诉你
n12801447,组图：冬季风暴过后3周 杰克逊市仍缺水
n12802260,福西：美染疫病例恐再度大增
n12801596,被18所大学录取 美17岁女孩获奖学金逾百万
n12801344,芝加哥警察捡到钱包 驱车两小时送还失主
n12802470,研究：礼来公司联合疗法降低染疫重症和死亡
n12802720,新泽西将暂停令延至6月 客户未缴费也不可断水电
n12803001,拜登1.9万亿纾困计划 众议院通过更新版
n12803158,美国加快疫苗接种 德州会100%重新开放
n12803329,拜登：政府将再购买1亿剂强生疫苗
n12803553,获教师工会认可 洛学区小学生4月中返校
n12803428,德州检察长回击推特：愿在德州开展法律战
n12794177,念九字真言 美国一中共病毒患者神奇康复
n12803517,当选议员卢克‧莱特洛遗孀竞选席缺 川普支持
n12804043,猩猩界奇迹 猩妈突然离世 猩爸悉心照顾幼崽
n12804837,美国励志演说家：改变我人生的一句话
n12805207,冬季大风暴来袭 美西多州面临大雪或暴雨
n12805776,失业金欺诈待解决 EDD增2百多接线员
n12805890,大麻合法化具争议 未成年者新规令人忧
n12805908,克鲁兹所获荣誉奖被普大辉格协会撤销
n12805426,拜登签署纾困法案 本周末起发放1400美元支票
n12805963,拜登：5月1日前开放全美成人接种疫苗
n12805959,美众院军委会领导层要求缩减国会国民警卫队
n12806462,美国数百人目击UFO 电视台派记者搭机调查
n12806132,墨西哥总统：拜登庇护政策助长人口贩卖
n12807415,美入夏令时 研究：缺失1小时睡眠有害健康
n12807793,新泽西一半将成洪灾区？ 新标准引担忧
n12807441,绑匪试图抢走训练有素的搜救犬 反被教训
n12807752,疫情趋缓 新泽西再放宽餐厅健身房人数限制
n12807642,分析师：COSTCO会员费或将涨价
n12807933,美1.9万亿美元疫情救助法案 各州所得一览
n12808168,明尼阿波利斯付2700万 与弗洛伊德家人达和解
n12808295,CBP：流入美国的芬太尼数量创历史新高
n12808600,洛杉矶县府游民安置设施 被控违反防疫规定
n12808668,聚焦中共种族灭绝罪行 纽约人抵制北京冬奥直播
n12808624,误以为法拉盛图书馆开打疫苗 民众大排长龙
n12808612,法拉盛文艺中心临苗点爆满 两天接种五百人
n12808656,纽约户外观影新体验“汽车剧院”回归
n12809163,【名家专栏】禁苏斯博士书无关打击种族主义
n12809426,1.9万亿纾困法案向美国人提供的七项福利
n12809624,美法官暂时叫停国防部对小米的投资禁令
n12809687,川普意外现身海湖庄园活动 做出一个暗示
n12809806,北美周日凌晨改夏令时 专家：今年更容易适应
n12810268,【疫情3.14】荷兰抗议封锁  警方使用水炮警犬
n12803625,美杜克大学逾180人染疫 本科生隔离至21日
n12810414,病毒恐导致厌食及嗅觉失灵 专家支招
n12810894,美科罗拉多州遭暴风雪袭击 逾两千航班取消
n12810934,NASA宇航员又进行太空行走 历时近7小时
n12811076,佛州迈阿密海滩周末人潮聚集 约百人被捕
n12812087,美军传奇狙击手 如何在越战中歼灭女对手？
n12812068,组图：美国丹佛遭暴风雪侵袭 陆空交通受阻
n12812063,【疫情3.15】欧洲十三国停用阿斯利康疫苗
n12812419,老牌男星汤姆‧塞莱克分享33年幸福婚姻秘密
n12812864,纾困支票、报税和期限 您需要了解的几件事
n12809645,特区远程工作机会全国领先
n12809668,马里兰州取消就餐人数限制
n12809692,华府地区单身女性购房人数上升
n12809673,华府往返纽约及波士顿火车新增私人房间
n12809719,购买滞销车型 可能有更多优惠
n12814214,麦卡锡：10%非法移民获释前检测呈阳性
n12814600,打疫苗不忘拉琴 马友友疗愈人心的即兴演出
n12814641,【疫情3.16】接种二剂疫苗  德州妇女仍染疫
n12813698,服务员凭直觉助警告破凶杀案 救出失踪女童
n12813952,生命奇迹 11岁童天生心脏外露仍乐观面对
n12815036,无依之地等入围奥斯卡 传中共取消直播颁奖礼
n12813277,【有冇搞错】枪杆子里出政权 美国禁枪拥枪争议
n12814833,肺纤维化少年破马拉松纪录 欲参加铁人三项赛
n12815570,“全世界中国古典舞大赛”九月纽约举行
n12815749,新泽西餐馆健身房赌场本周五起扩大容量至50%
n12815756,新泽西美国梦购物中心将开放更多景点
n12814960,【名家专栏】主流媒体图谋美国社会激进变革
n12815758,民调：疫情后 更多美国人视中共为最大敌人
n12816051,【快讯】乔州三按摩店爆枪案 8死含4亚裔女
n12816115,拜登上任2个月油价飙涨$1 川普：比加税还可怕
n12815937,国际空间站发现四种细菌 三种是不明菌株
n12816611,为什么美国的校车上有多条黑线？
n12816901,全球首创 3D列印社区将出现在美国加州
n12816894,德州为首 告谷歌垄断 美再有5州及地区加入
n12816896,【疫情3.17】加州变种传播快 CDC担忧
n12817242,如何快速还清学生贷款？美27岁女记者心得
n12816336,洛杉矶部分餐厅恢复堂食 民众叹久等了
n12817721,乔州按摩店枪案8死含6亚裔女 枪手身份曝光
n12810118,全美现购枪潮 NICS枪支背景调查数创新高
n12817199,露宿者进餐馆求职 善心老板助其改变命运
n12818206,莱克伍德市发生大火 170亩地被烧 数十座建筑受损
n12818230,新泽西州莱德大学计划秋季恢复面授教学
n12818232,美国国税局计划将报税期限延至5月17日
n12818326,被控1月6日向警官喷化剂 两男子被捕
n12818869,美国女子徒手移除蜂窝 她是如何做到的？
n12820113,马州延长州税申报日期三个月
n12820167,华盛顿特区IT职位空缺居全国之首
n12820182,马州启动大规模疫苗接种点预注册网站
n12819334,长年喝汽水致牙齿烂光 年轻女后悔不爱刷牙
n12819824,美国911恐袭中 一名盲人是如何成功逃生？
n12820002,美国高中篮球运动员把自己的鞋子送给对手
n12820536,因支持川普 新泽西国会议员受死亡威胁
n12820660,新泽西州长：国殇日前望恢复一定程度正常状态
n12820977,接种疫苗后是否需戴口罩 保罗与福奇爆争执
n12821405,受迫害团体白宫前集会 吁抵制2022北京冬奥
n12821677,美国男子花35美元买青花瓷碗 2万倍天价售出
n12821546,美参议员：拜登政府将威胁评估“政治化”
n12820953,华人热议：亚城枪击案和“仇视亚裔”有何关系
n12821618,宛如白珍珠 加州海域再现珍稀白化海豚
n12822302,被炸弹炸掉双腿的女孩 目标：2021年残奥会
n12823154,美CDC建议在教室里保持3英尺社交距离
n12820559,新泽西疫情：公共卫生紧急状态第13次延期
n12823121,加州神父遭调查 曾为拜登就职主持弥撒
n12823664,联合广场约500名民众追思乔州按摩院枪案死者
n12823749,直到4月底 纽约每周疫苗增量33%
n12823720,纽约市警：言语攻击不构成仇恨犯罪 鼓励民众报案
n12823670,民主党纽约市长候选人谈游民毒品与监狱问题
n12823867,世界最快乐国家：芬兰四连冠 台湾列东亚第一
n12824359,美国牧师：信仰帮助巩固家庭 从而改变国家
n12824777,多数美国人觉得税负过重 反对任何新税收
n12826948,美国土安全部长：边境已关闭 移民不要来
n12827458,心情高低起伏 男子遗失百万美元彩券后寻回
n12827503,【疫情3.22】纽约市488所中学今重新开放
n12828530,消息：亚特兰大按摩店凶手尚不构成仇恨罪
n12828808,【快讯】科罗拉多州爆枪击案 枪手在逃
n12828608,好莱坞制片人：从喂龙到觉醒（上）
n12828743,度假者无视宵禁令 迈阿密警方1个月逮捕上千人
n12829091,用无人机送大麻 男子洛杉矶被捕
n12829111,重大车祸频发 CHP：车流回升 谨慎驾驶
n12829039,科罗拉多超市枪击案 10人死亡含一警官
n12829086,前情报总监：五角大楼将公开更多UFO信息
n12830527,【视频】纽约养老院大火 一死两伤一失踪
n12829561,学生不满新发型执意戴帽 校长暖心回应获赞
n12830892,科罗拉多枪案幸存者：薯片救了我的命
n12831328,美国人自驾游开始前 油价冲向每加仑三美元
n12831339,人权组织吁Airbnb取消赞助北京冬奥会
n12831463,加州封锁经济一年之际 失业金系统再瘫痪
n12831306,五角大楼前官员：UFO属实 有三种起源理论
n12832436,19世纪美国医生怕醒来没人救 坟墓加开天窗
n12832446,组图：纽约州养老院大火 造成一死一失踪
n12830256,猫咪受困15米树梢 树医30秒攀高成功救援
n12833263,科罗拉多血案 目击者回忆枪手被降一刻
n12833599,审查德州边境收容所图片？推特归咎软件错误
n12833022,组图：德州遭遇强风袭击 百年建筑物受损
n12833974,好莱坞制片人：从喂龙到觉醒（下）
n12833873,研究：COVID-19感染可能会引发糖尿病
n12834255,新泽西发布新规定：雇主可要求雇员接种疫苗
n12834260,野生动物保护区呼吁游客停止喂鹿
n12836228,纽瓦克火车站发生火灾 公交车火车服务延误
n12836596,海滨城镇新令 不准狗进入海滩和木板道
n12836618,感染中共病毒儿童心脏或受损 回归运动应谨慎
n12836671,新泽西失业超200万 一些公司将开始夏季招聘
n12836446,龙卷风横扫阿拉巴马州 致5死数十伤 房屋被毁
n12836756,研究发现孩童们更偏爱使用相同语言者
n12836709,卧室现神秘井盖 加州女打开惊见冷战防空洞
n12838043,龙卷风在阿拉巴马至少酿五死 乔治亚变战场
n12836707,新泽西学校9月份新学年将不允许上网课
n12837883,奇迹！日发百次癫痫患儿 已18岁学三种语言
n12836723,变种病毒传播 或致新泽西州新病例上升
n12838880,IRS：个人防疫用品费用可抵税
n12839100,吁民冷静保护自己 南加警长：仇恨犯罪未增加
n12839239,纽约海顿天象馆有限度重开
n12839219,纽约州府30日举行论坛 回应针对亚裔仇恨犯罪
n12839213,疫情爆发后 纽约市府每晚花100万让游民住酒店
n12839202,亚美医师协会为华埠长者接种第二针疫苗
n12839197,CDC提醒 接种疫苗后记录卡不可丢
n12839189,中华公所正争取成为长期接种点
n12839107,美司法部去年起诉474人 指控利用疫情欺诈
n12839285,纽约法拉盛华人珠宝店 光天化日遭暴力抢劫
n12839242,曼哈顿居民迁居长岛苏福克郡比例最高
n12839210,纽约州推出“健康码”民众参加活动前扫码入场
n12839207,严打不良报税 纽约州逮捕7人
n12839216,民调：商业决策者大都不热衷“进步思想”
n12839245,近四千片不合格中草药眼贴 被美匹兹堡海关查获
n12839488,加州老教师失业住车里 学生募款助恩师渡难关
n12840077,弗吉尼亚海滩发生枪案 两死 逾八人伤
n12839975,美国“女铁人三项赛” 67岁获奖者的故事
n12840164,美国税局将加快发放1400美元纾困支票
n12839719,【财商天下】打破富人魔咒 史上首位亿万富豪
n12840882,美国男子离职 老板竟以9万多个硬币付薪水
n12840844,【疫情3.28】台湾帛琉建立“无菌”旅游走廊
n12841109,德州暴风雪中 坚强妈妈在车上生下早产儿
n12841110,从余烬中重燃火焰：复兴信仰希望和仁爱
n12841530,马里兰州发现一颗160年前炮弹 威力强大
n12841600,66岁亚裔司机惨死 两少女被控劫车谋杀
n12842865,【疫情更新3.29】美新增病例连续第二周上升
n12844187,正在推行疫苗护照？拜登政府否认
n12844196,美CDC主任：病例再上升 恐怖前景令我害怕
n12844774,禁驱逐、收不到租金达一年 民主党州房东现况
n12844834,因疫情搬出城市 美国年轻人或终将回归
n12844855,美国歌手威斯特 身价暴涨至66亿美元
n12844864,最高法院裁决利于起诉大公司
n12845324,肉牛逃离屠宰场被抓回 美国上万人连署抢救
n12845486,【疫情更新3.30】美上周新增病例上升12%
n12846179,Nike就含人血的“撒旦鞋”提出诉讼
n12847214,美国等14国发表声明 关注世卫推迟疫源调查
n12847345,抢劫重罪或轻判 加州警检：立法者危害社区
n12847232,美国正遭遇第四波COVID-19疫情冲击
n12848194,美国91岁警察还在保护人民 无退休打算
n12848157,不忍同事严寒骑车上班 17岁女抽中汽车相送
n12848528,美一家庭餐馆为老兵百岁生日赠送100餐
n12848652,获捐品中发现4.2万美元现金 员工上缴获赞
n12849390,大麻合法青少年条款遭反对 新泽西州定新法修正
n12849805,CDC：中共病毒为美国人2020年第三大死因
n12849836,华盛顿州102人接种疫苗后病毒检测呈阳性
n12851639,南加州发生大规模枪击案 四死包括一名儿童
n12852058,耐克寻求人血“撒旦鞋”限制令 获法官批准
n12850967,从小自主学习 17岁女成美国最年轻博士
n12852627,辉瑞：疫苗有效率达91% 可防南非变异株
n12852693,新泽西罗格斯大学强制学生接种疫苗 成全美首例
n12852572,加州橙市枪击案：凶嫌或为业务个人动机
n12852911,州长签署小企业救济法案 提供2500万元援助
n12852951,强生公司部分中共病毒疫苗质检不合格
n12852964,拜登政府将帮助新泽西扩大风能开发
n12852991,美最高院裁定 FCC可放松媒体所有权管制
n12853288,洛县将迎橙级防疫限制 民众欢喜外出用餐
n12853043,德州参院通过法案 社媒不得审查用户政治观点
n12853297,美边防官员：今年或有上百万非法移民越境
n12853445,癌末顾客想吃天妇罗 老板驱车6小时上门做
n12854206,飞行前坐轮椅 下飞机健步如飞 原因引人思考
n12854266,夫妇缩小房屋面积 2年还清12.5万美元债务
n12854855,【快讯】美国会大厦外袭击 警员1死1伤 嫌犯死
n12853056,新泽西第三波疫情来袭 预测4月中达高峰
n12854265,居民赠意外礼品 小镇唯一UPS司机感动落泪
n12855134,CDC：完全接种疫苗后可在美境内安全旅行
n12855284,橙市枪杀案凶嫌被起诉 4名死者身份确定
n12855192,报告预测北维州住房市场将持续走高
n12855187,巴尔的摩不再起诉藏毒 卖淫等违法行为
n12855230,全美最有价值高校排名 维吉尼亚大学名列12
n12855220,华府更多博物馆将重新开放
n12855236,维吉尼亚州州长提议加快大麻合法化
n12855242,维州养老院疫情死亡率 全美第二高
n12855611,反对乔州选举法改革 MLB移地举办全明星赛
n12855618,纽约市警局总警司：与华埠民众合作打击仇恨犯罪
n12855468,长岛足疗店两华人涉无照执业被捕
n12855483,距完全重开还有多远 盘点纽约的限制令
n12855492,亚裔律协免费网上咨询 4月6日开始
n12855474,4月1日纽约市创单日93,380剂疫苗接种纪录
n12855478,美移民局：庇护申请表留空白 不再一律退回
n12855890,民调：72%美国人支持投票须出示身份证明
n12855523,美国左派要将监狱人口减半 暴力犯罪恐更多
n12855471,纽约治安恶化 州少数党领袖：政策失败
n12856030,美国高中一管理员汽车报废 同事惊喜赠新车
n12856560,周六全美爆三起枪击案 6死9伤
n12856856,橙市枪杀案嫌犯被控多项谋杀重罪
n12856756,美国税局发第三批纾困支票 含社安福利受益人
n12856882,黑客论坛公开提供五亿Facebook账户私人信息
n12856948,大公司抵制乔州选举法改革 川普呼吁反抵制
n12857230,小鹿撞破挡风玻璃飞进美国校车 吓坏学生
n12856977,数量超过31万 美国国鸟白头鹰复育成功
n12858541,美边境危机加剧 边境处理设施部署新人力
n12858892,【疫情更新4.5】美新增病例连续第三周上升
n12859594,南加州系列地震 最高4级 洛杉矶有震感
n12859427,密歇根华人保守联盟发起亚裔集会 吁谴责暴力
n12859399,美国男子高速桥边欲轻生 热心路人勇救
n12859439,96岁的二战老兵为救世军编织数百顶帽子
n12859388,男子被车撞倒后 新郎新娘反应令人吃惊
n12859536,【役情最前线】5亿FB账户信息外泄 涉300万港人
n12860186,卢比奥斥美职棒虚伪 经济利益优先中国人权
n12860098,美每天310万人接种疫苗 年轻人感染率激增
n12860600,儿子升少尉 美军士官长骄傲地向他敬礼
n12860430,温馨！十岁哥哥半夜爬起来安抚哭闹的小弟
n12860478,路过冰湖 德牧狂吠 提醒主人救回落水男
n12861038,【疫情4.6】加州计划6月全面重新开放经济
n12861974,开枪伤二人后闯军事基地 美军医务兵被击毙
n12862447,阿肯色推翻州长否决 全美首州禁未成年人变性
n12861593,【名家专栏】弗洛伊德案你所不知道的过程
n12862253,神秘无人机在美舰上空盘旋 两年后仍是谜
n12862440,德州禁止推行COVID-19疫苗护照
n12862599,白宫：16岁以上美国人4月19日前均可接种疫苗
n12862751,乔州选举法争议 MLB全明星赛移师科罗拉多
n12863333,本想减肥 78岁奶奶打破19项举重世界纪录
n12864017,【微视频】朝鲜为何退出东京奥运会？
n12864238,相识不久 女大学生四肢瘫痪 男友不离不弃
n12864897,上海机场对美国人设高度机密黑名单 含9岁童
n12865029,南加兄妹涉600万售房骗局被捕 最高可判162年
n12865564,88个买家抢购一所房子 美国房市狂热未减
n12865577,大趋势：美国凤凰城商场出售 将变小型社区
n12865593,中共病毒永久性改变美国人餐饮方式
n12865614,脸书账号遭窃 你是否在其中
n12865381,美CDC：英国变种病毒已成美国主要感染病毒
n12865566,国家档案局将公开川普被删除的所有推文
n12866902,双胞胎四年前头部成功分离 现面临新挑战
n12867484,接种后多人现副作用 科罗拉多关闭大型疫苗站
n12867618,新泽西近海河道大批鱼类突发死亡
n12866928,一年级女生对黑人同学的善举促成50年友谊
n12867787,加州新增五例“双突变体”变种病毒
n12868194,连锁店“皇家农场”将在新泽西招聘4500名新员工
n12868186,纽约、洛城港人携手以艺术发声
n12868257,橙县教委例会 父母反对学校强推疫苗
n12868286,新泽西数百万人接种疫苗 防疫能持续多久？
n12868385,分析显示：新泽西疫情应对居全美最差行列
n12868532,美国佛州举办小狗冲浪比赛 成复活节传统
n12868707,反拜登控枪 州长：德州将成第二修正案庇护州
n12868413,新泽西疫情：年轻人感染和住院越来越多
n12869608,美国家公园管理局公布2020年最受欢迎景区
n12870367,不良反应频现 美多地暂停接种强生疫苗
n12870545,疫情下 加州政策导致犯罪率激增
n12870578,橙县与尔湾答疑会：不会强迫人们打疫苗
n12870629,加州考虑拨款5亿提早行动防野火
n12870640,南加大研究：音乐视频在教年轻人吸电子烟
n12870828,纽约康尼岛乐园重启 暂在周末营运
n12870808,下周纽约强生疫苗供应减少88%
n12870826,纽约市推“病后护理” 帮助长期后遗症染疫患者
n12870967,美国研发超音速总统专机 内装豪华精美
n12871334,主人摔倒受伤 骡子引导两位远足者救主人
n12871738,洛杉矶三幼童陈尸屋内 30岁女嫌已被捕
n12871794,CDC：Moderna疫苗比辉瑞疫苗有更多副作用
n12871817,拜登政府考虑给中美洲送钱 控制难民入境
n12871798,《纽约时报》多名员工曾为中共官媒工作
n12872118,精准无比 闪电击碎美国威州高中的一棵树
n12872530,二岁童误服过量芬太尼昏死 机智警察及时救活
n12873206,春暖花开 新泽西户外活动推荐（上）
n12873565,美国二手品牌热卖 在线电商收获不菲
n12873587,疫情让美国人发福 减肥者重返健身房
n12873612,中共病毒对美国儿童造成戕害
